title	description	coder 1	movie 1	topic 1	coder 2	movie 2	topic 2	final movie	final topic
Taylor Swift Will Seemingly Attend Beyonce's Movie Premiere in London - Get the Details	Taylor Swift missed out on an exciting opportunity to support fellow pop icon Beyonce at the premiere of Renaissance: A Film By Beyonce over the weekend, but Swifties are convinced that she’ll be on the red carpet for the movie’s London premiere on Friday (No…							Renaissance	Promo
How Donnie Darko And Martin Scorsese Influenced Five Nights At Freddy's	Believe it or not, the star and director of Five Nights at Freddy&amp;#39;s took inspiration from Donnie Darko and Martin Scorsese&amp;#39;s Casino.							FNAF	Prod
The Marvels Is On Track For One Of The MCU's Lowest Box Office Openings	Bad news for The Marvels: the latest from the Marvel Cinematic Universe looks to be headed towards a less-than-great opening weekend at the box office.							Marvels	Box
Leonardo DiCaprio Reacts to Rapping Video, Reveals His Range in Musical Taste as He Nears 50	Leonardo DiCaprio is speaking out about the video of him rapping at his recent 49th birthday party! The Killers of the Flower Moon star was having fun at his star-studded celebration last weekend, took the mic and started rapping. Now, in a new interview, Leo…							KOTFM	Promo
The Marvels Star Iman Vellani Talks Working With Kittens, Young Avengers & More [Exclusive Interview]	We spoke with The Marvels star Iman Vellani about working with kittens, teasing the Young Avengers, deleted scenes, and who her own personal Captain Marvel is.							Marvels	Promo
Robert De Niro Claims His ‘Killers of the Flower Moon’ Tribute Speech Was Censored	While presenting at the Gothams, De Niro accused Apple and the awards organization for slashing some of his planned remarks from the teleprompter: “How dare they do that, actually?”							KOTFM	Box
Damn, What Does Disney Have Against Nia DaCosta?	The Marvels is likely going to end up one of Marvel Studios’ worst-performing films in a considerable period of time—and at a time when people are largely questioning the direction of a franchise that has dominated cinema for 15 years, that’s not an ideal bit…							Marvels	Plot
Trolls Band Together Review: A Merciless Sensory Overload	It’s time for me to do what all rational adult men do: write detailed, in-depth thoughts about Trolls Band Together, an animated jukebox musical comedy movie made for children. As I type these words, my sanity slips even further. Not only because it’s late at…							Trolls	Plot
One Of The Most Striking Moments In Napoleon Kind Of Happened, But Not Really	Did The Battle of Austerlitz happen the way it is depicted in Ridley Scott&amp;#39;s new epic Napoleon? Well, not exactly.							Napoleon	Plot
Godzilla reigns eternal thanks to years of tiny design changes	Apple TV’s Monarch is the latest show to feature a new Godzilla design. But with Minus One in theaters, the design history tells the story of the King of the Monsters.							Godzilla	Prod
How to watch Killers of the Flower Moon	The Martin Scorsese epic starring Leonardo DiCaprio was financed by Apple, but how can you watch it?    Right now, Killers of the Flower Moon is available to buy or rent on the iTunes Store, , and other VOD platforms. In the future, it will be streaming for A…							KOTFM	Streaming
'The Hunger Games' prequel kicks off weekend with $5.8M from Thursday previews	'The Hunger Games: The Ballad Of Songbirds & Snakes' Begins With Thursday Previews Around $6M - Box Office https://t.co/LkTSRqoMeB — Deadline Hollywood (@DEADLINE) November 17, 2023  'The Hunger Games: The Ballad Of Songbirds & Snakes' opened this weekend t…							HG	Box
The Marvels Star Iman Vellani Says The Box Office Is Disney CEO Bob Iger's Problem	The Marvels&amp;#39; Imran Vellani has wise words for those who wonder what she thinks about the MCU movie&amp;#39;s box office performance.							Marvels	Box
7 best cosmic Marvel characters ever, ranked	There are more heroes in space than The Marvels. Let's dive into the seven best cosmic Marvel characters, most of whom aren't in the MCU!							Marvels	Plot
The 20 best on-screen Napoleons	Napoleon Bonaparte died on May 21, 1821, but the iconic French emperor has lived on (and on and on) in numerous movies and television shows. Esteemed director Ridley Scott, who dipped his l’orteils in the water with 1977’s Napoleonic War drama The Duellists, …							NM	
'The Marvels' bombs with worst MCU opening yet	The age of superhero movies is over. 'The Marvels,' already perceived as the MCU's Hail Mary, failed to crack $48m on its opening weekend. With a $274.8m official budget (and much more spent on marketing), it is all but doomed to be the fall movie season's bi…							Marvels	Box
Which Oscar Contenders Got the Biggest Boost From the End of the Strike?	With the end of the SAG strike, awards campaigning can finally start in earnest. Which 2024 Oscar contenders will do well on the trail?							NM	Awards
Only One 2023 Movie with a Budget Over $200 Million Has Made a Profit (So Far) This Year	Only One 2023 Movie with a Budget Over $200 Million Has Made a Profit (So Far) This Year https://t.co/ucNqFWaa1w — IndieWire (@IndieWire) November 27, 2023 sourcethe year of big budget flopsOut of the 14 movie this year that had a $200M+ budget only one made…							NM	Box
As Awards Season Picks Up, Critics Are Giving Martin Scorsese His Flowers	The New York Film Critics Circle sprang for Martin Scorsese’s ‘Killers of the Flower Moon,’ which won both Best Picture and Best Actress.							KOTFM	Awards
The Marvels' Box Office, Deadpool Leaks, and More Top Pop Culture News of the Week	Image: Marvel Studios, 20th Century Studios, Jeff Spicer/Getty Images for Disney, Universal, BBC, BBC, Bottleneck Gallery, Screenshot: YouTube It’s been a bit of an up-and-down week for the House of Ideas, as Marvel both pulled out of reporting any further o…							Marvels	Box
Five Nights At Freddy's Passes $300 Million At The Box Office, Get Ready For Some Sequels	Five Nights at Freddy&amp;#39;s has grossed more than $300 million worldwide against a production budget of just $20 million.							FNAF	Box
Stride Management Signs ‘Killers Of The Flower Moon’s Cara Jade Myers	EXCLUSIVE: After being seen starring alongside Leonardo DiCaprio, Robert De Niro, Lily Gladstone and more in Martin Scorsese’s historical epic Killers of the Flower Moon, based on the work of non-fiction by David Grann, actress Cara Jade Myers has signed with…							KOTFM	NR
How To Watch Napoleon	Ridley Scott's movie Napoleon starring Joquin Phoenix releases in theaters before its eventual streaming release. Here is how and when to watch it.							Napoleon	Streaming
The Hunger Games: The Ballad of Songbirds and Snakes Debuts Atop the Domestic Weekend Box Office	The Hunger Games: The Ballad of Songbirds and Snakes has won the domestic weekend box office by holding off both Trolls Band Together and The Marvels by earning $44.0 million in tickets sales.							HG	Box
Cool Stuff: Five Nights At Freddy's Brings The Animatronic Terror To 4K Blu-Ray In December	The horror hit Five Nights at Freddy&amp;#39;s is coming home to digital and 4K Blu-ray very soon. Get all the details right here.							FNAF	Streaming
Five Nights At Freddy's Is Now Blumhouse's Biggest Movie Ever At The Box Office	Blumhouse has a long history of monster horror hits at the box office, but Five Nights at Freddy&amp;#39;s is officially their biggest smash yet.							FNAF	Box
This Anne Hathaway thriller is 2023’s freakiest movie. Here’s why you should watch it	You may not have heard of this 2023 Anne Hathaway thriller, but it's one of the best movies of the year. Here's why you should watch it.							NM	Promo
Olivia Rodrigo - Can’t Catch Me Now (from The Hunger Games: The Ballad of S&S) (Official Video)	"Liv premiered the music for her new single (""Can't Catch Me Now"") to from The Hunger Games: The Ballad of Songbirds & Snakes . Olivia Rodrigo tells THR she was thrilled to write a song for TheHungerGames : The Ballad of Songbirds  Snakes and teases her upcomi…"							HG	Promo
Will Napoleon’s Oscar Campaign End in Victory?	Ridley Scott’s historical epic ‘Napoleon’ charged into the Oscars race this week, with a surprise worthy of Austerlitz: the movie is funny. Will its awards campaign end in victory?							Napoleon	Awards
GODZILLA MINUS ONE Surpasses Initial Projections For Record-Breaking $11 Million North American Debut	The 37th film in the Godzilla franchise continues to score big at the box office as the film broke records in its North American theatrical debut this past weekend.							Godzilla	Box
Godzilla Minus One Director And Star On Making Godzilla Terrifying Again [Exclusive Interview]	/Film spoke with Godzilla Minus One director Takashi Yamazaki and star Ryunosuke Kamiki about bringing the King of the Monsters back to the big screen for Toho.							Godzilla	Promo
Why Godzilla Minus One's Box Office Makes It Such A Surprising Hit	On today&amp;#39;s episode of the /Film Daily podcast, Ryan and Ben talk about Godzilla Minus One&amp;#39;s box office performance and look ahead to the first half of 2024.							Godzilla	Box
Martin Scorsese’s editor on the inside story of Killers of the Flower Moon	The director’s longtime editor Thelma Schoonmaker discusses his latest movie and the erotic power of Powell & Pressburger							KOTFM	Promo
Disney's 'Wish' Was Expected to Debut at #1 -- but Loses to 'Hunger Games,' 'Napoleon' at Box Office	In a close contest for second place, Ridley Scott's “Napoleon” narrowly outmaneuvered Disney's “Wish” at the box office.							HG, Napoleon, Wish	Box
'Hunger Games' prequel tops Thanksgiving box office, 'Napoleon,' 'Wish' battle for second	'The Hunger Games: The Ballad of Songbirds & Snakes' fended off 'Napoleon' and 'Wish' to stay at the top of the domestic box for a second straight weekend.							HG, Napoleon, Wish	Box
How do you make peace with your shortcomings? This man has an answer	Comedian Duncan Trussell speaks on the value of transcendent experiences and how he thinks about life after death.							NR	
The Hunger Games: The Ballad of Songbirds & Snakes’ ending, explained	Here's everything that happens at the end of The Hunger Games: The Ballad of Songbirds & Snakes.							HG	Plot
Robert De Niro's Gotham Awards speech went off the rails after he realized his anti-Trump comments were edited out	Robert De Niro said that a part of his speech was edited out from the teleprompter he was reading from at the Gotham Awards.							NM	
Israel loosens rules for retrieving sperm from corpses	For years, the Israeli government has allowed for widows to request posthumous sperm retrieval from fallen soldiers in the Israeli Defense Force. As The Times of Israel explains:     Sperm must be retrieved within 24 hours after death to increase its chances …							NR	
Robert De Niro Says Part Of His Speech Excised At Gotham Awards Then Lets It Rip For ‘Killers Of The Flower Moon’ Tribute	Robert De Niro led an eventful to a Killers Of The Flower Moon tribute at the Gotham Awards, seeming to struggle with the teleprompter then circling back to say that his speech had been edited without his knowledge. The star of Martin Scorsese film then went …							KOTFM	NR
Martin Scorsese Plays The Movie Bracket Challenge In New TikTok (& An Absolute Classic Wins)	Octogenarian auteur and certified cinephile Martin Scorsese participates in the TikTok movie bracket challenge, and a classic film wins his bracket.							NM	
The Joys of Carole Lombard, Zadie Smith, and High-School Movies	Entertainment musts from Jennifer Senior							NM	
Photos from the Hunger Games Los Angeles premiere	pic.twitter.com/y3vnq3GvgM — ' (@cravemedia_) November 14, 2023Tom Blyth and Rachel Zeglerpic.twitter.com/W4HvFzYglh — ' (@cravemedia_) November 14, 2023Hunter Schaferpic.twitter.com/jNqoYn244F — ' (@cravemedia_) November 14, 2023Viola Davispic.twitter.com…							HG	Promo
Francis Ford Coppola Says Ridley Scott ‘Should Be Given a Dukedom for Such Outstanding Outstanding Quality Output’	"There have been rare artists who astounded everyone with their best work while in their eighties, Coppola said, ""but we must take our hats off to Ridley."""							NM	Prod
The Hunger Games: The Ballad of Songbirds & Snakes Ending Explained & Spoilers	After The Hunger Games: The Ballad of Songbirds & Snakes‘ ending left many fans speechless, they are curious about what really happened. Here is the ending explained with spoilers. Did Lucy Gray-Baird die? It is unknown if Lucy Gray-Baird died or is still ali…							HG	Plot
Martin Scorsese To Receive David O. Selznick Award From PGA	Martin Scorsese has has received virtually every award possible for his work, including an Oscar, a Grammy, Emmys, Golden Globes, BAFTA and DGA awards, the AFI Life Achievement Award, the HFPA’s Cecil B. DeMille Award and a Kennedy Center Honor. On February 2…							NM	Awards
Apple original film ‘Killers of the Flower Moon’ will be available to buy/rent from tomorrow	The much-hyped Apple original film Killers of the Flower Moon (starring Leonardo DiCaprio, Robert De Niro, and Lily Gladstone) will be available on video-on-demand services to buy or rent from tomorrow, Apple announced today. It will be available at “leading …							KOTFM	Streaming
Here are the winners from the 2023 Gotham Awards	The Gotham Awards were tonight, which means that the Joker took his yearly one-night sabbatical to allow awards season to officially begin. The Gotham Awards ceremony is among the first shows of the entertainment awards marathon we’ll be running for the next …							NM	Awards
Toho's GODZILLA MINUS ONE Broke a Box Office Record	This past weekend, Toho released Godzilla Minus One in the United States, and for a Japanese film, it had an awesome debut and even broke a box office record. Godzilla Minus One pulled in $11 million in its domestic debut, giving it the all-time highest openi…							Godzilla	Box
‘The Hunger Games: The Ballad of Songbirds & Snakes’ Review: Is There Any Appetite Left?	This Hunger Games prequel is well-made and entertaining, but its dystopia may edge too close to present reality.							HG	Plot
The Marvels Mid-Credits Scene Gave Iman Vellani A 'Heart Attack' [Exclusive]	The Marvels star Iman Vellani is a fan of the MCU, so when she saw the mid-credits scene of her movie, she fangirled out for real.							Marvels	Plot
“The Hunger Games: The Ballad Of Songbirds & Snakes” Makes It To New York	Hnter Schafer continues to kill this. The post “The Hunger Games: The Ballad Of Songbirds & Snakes” Makes It To New York first appeared on Go Fug Yourself.							HG	Promo
Rachel Zegler, Tom Blyth, & More Stars Stun at 'The Hunger Games: The Ballad of Songbirds & Snakes' World Premiere	The Hunger Games: The Ballad of Songbirds and Snakes is having its world premiere! Stars hit the red carpet on Thursday (November 9) in London, England to celebrate the release of the film, which opens in theaters worldwide on November 17. Rachel Zegler, Tom …							HG	Promo
THE HUNGER GAMES: THE BALLAD OF SONGBIRDS & SNAKES Star Hunter Schafer in Balmain and Alexandre Vauthier on THE TONIGHT SHOW	Miss Hunter knows the value of a kickass walking-out-of-the-studio look for the paps and the value of a sweetly cute on-camera look for the folks at home.   It hasn’t been quite cold enough for something this dramatically large and heavy, but she clearly does…							HG	Promo
How Ridley Scott’s Napoleon Stacks Up Against the French Emperor’s Real Story	A Napoleon scholar breaks down where Ridley Scott's new movie, starring Joaquin Phoenix, hews close to history, and where it takes creative license.							Napoleon	Plot
Killers Of The Flower Moon's Original Ending Almost Sent Up A Classic Jimmy Stewart Movie	The way Martin Scorsese ended Killers of the Flower Moon will go down in film history books, but he almost ended the film in a different, equally powerful way.							KOTFM	Plot
National Board of Review Names Best Movies & Actors of 2023 - Full Winners List Revealed!	The National Board of Review is announcing their picks for the best of the best in film! The organization revealed their choices on Wednesday (December 6). The winner of NBR’s best film has typically gone on to receive an Oscar nomination for best picture, wi…							NM	
The Hunger Games: The Ballad of Songbirds & Snakes Pitch Meeting	The new episode of Screen Rant's Pitch Meeting series takes a look at The Hunger Games: The Ballad of Songbirds &amp; Snakes and the flaws of the prequel.							HG	Plot
Five Nights At Freddy’s Box Office Passes Big Horror Movie Milestone	Five Nights at Freddy's, which is adapted from the video game franchise of the same name, surpasses an important milestone at the global box office.							FNAF	Box
Netflix’s Memorabilia Shop Is Having a Black Friday Sale	Love sales on ‘Stranger Things’ basketballs, Bruce Lee action figures, and ‘Cowboy Bebop’ shirts? Buddy, you’re not gonna believe this.							NR	
When is The Marvels coming to Disney Plus?	Want to know when you can watch The Marvels on Disney Plus? We try to answer that question.							Marvels	Streaming
Bill & Ted's Napoleon reflects on ice cream, water slides, and learning French	Joaquin Phoenix may be the latest actor to play Napoleon Bonaparte, but he certainly isn’t the first (nor will he be the last). Of all the people who’ve played the French emperor, from Marlon Brando to Verne Troyer, one looms large in our collective memories:…							Napoleon	NR
Martin Scorsese Honors Robbie Robertson’s Legacy with Tribute Concert: The Musician ‘Broke Barriers’	"The late The Band guitarist and the auteur collaborated on films like ""Raging Bull,"" ""The Wolf of Wall Street,"" and ""Killers of the Flower Moon."""							KOTFM	NR
The Hunger Games: The Ballad of Songbirds & Snakes rakes in around $6 million in Thursday previews	The first entry in The Hunger Games series without Jennifer Lawrence has an uphill battle and reaches a humble $6 million on early showings. The post The Hunger Games: The Ballad of Songbirds & Snakes rakes in around $6 million in Thursday previews appeared f…							HG	Box
Black Friday Funko Pops Discounts Bring The Entire Multiverse To Your Desk	If there's something moderately popular at the movies or on TV, there's a good bet that you'll find a Funko Pop figure of it soon. One of the most popular collectibles around, Funko Pops are everywhere and they have their legions of fans. It's not hard to see…							NR	
‘Killers of the Flower Moon,’ ‘May December’ Surge in Oscar Race With NYFCC Awards	Martin Scorsese and his breakout star, Lily Gladstone, came out on top with the New York critics, but there was still room for the likes of other major Oscar contenders, including ‘Oppenheimer,’ ‘The Holdovers,’ and more.							KOTFM	Awards
The mystery around Robert De Niro’s “censored” Gotham Awards speech deepens	At last night’s Gotham Awards, Robert De Niro made a speech about Martin Scorsese and Killers Of The Flower Moon that, naturally (for De Niro), veered into a whole thing about Donald Trump and how he “lied to us more than 30,000 times during his four years in…							KOTFM	NR
Heads up! You can now score a pair of Pixel Buds Pro for just $119.99 with this Amazon Black Friday deal	With their tight Android integration, the Pixel Buds Pro are a compelling buy this Black Friday at $119.99							NR	
Godzilla Minus One Director Reveals The Surprising Biggest Challenge Of Prequel Movie's VFX	Takashi Yamazaki, the director of Godzilla Minus One, reveals the surprisingly biggest challenge of the prequel movie's VFX development.							Godzilla	Prod
‘Trolls Band Together’ Reviews Roundup: Vibrant And Colorful Animation Are Fun Enough, But The Sequel’s Plot Is Thin	Critics agree that there is a lot for kids to enjoy in the film, although their parents may not be as entertained.							Trolls	Plot
Kamala Khan Is The Future Of The MCU – And The Young Avengers May Be Next	The Marvels mixes no bones about giving Kamala Khan a critical role in the future of the Marvel Cinematic Universe, and yes, it seems to include Young Avengers.							Marvels	Plot
Godzilla Minus One Director Wants To Helm A Star Wars Movie, And Maybe Lucasfilm Should Listen [Exclusive]	With Godzilla Minus One, Takashi Yamazaki helmed one of the best Godzilla movies out there. The Japanese director now has sights set on a galaxy far, far away.							Godzilla	NR
Beyoncé’s ‘Renaissance’ Tops Box Office With $21 Million Debut	Beyoncé ruled the box office this weekend. Her concert picture, “Renaissance: A Film by Beyoncé,” opened in first place with $21 million in North American ticket sales, according to estimates from AMC Theatres Sunday.     The post-Thanksgiving, early December…							Renaissance	Box
Robert De Niro Says His Anti-Trump Comments Were Edited Out of Gotham Awards Speech	Robert De Niro‘s speech at the 2023 Gotham Awards did not go as planned. The 80-year-old actor was present at the event on Monday (November 27) in New York City to present the Historical Icon and Creator Tribute award for Martin Scorsese‘s Killers of the Flow…							KOTFM	NR
Independent Spirit Awards 2024 - Complete List of Nominations Revealed!	The full list of nominations for the 2024 Film Independent Spirit Awards has been announced! Movies are only eligible for a Spirit Award if they have a budget of less than $30 million, so there are some awards favorites like Maestro and Killers of the Flower …							KOTFM	Awards
‘Killers of the Flower Moon’ Initially Had a Very Different Opening Scene	Martin Scorsese told IndieWire why he and screenwriter Eric Roth changed the beginning of their Western epic.							KOTFM	Plot
Napoleon Review - Ridley Scott Does It Again	It's quite amusing to look at Napoleon next to Ridley Scott's most famous historical epic, the Best Picture-winner Gladiator. While Gladiator is more or less just an extremely well-made prestige film that hits all the right notes according to the traditional …							Napoleon	Plot
Is Beyoncé’s ‘Renaissance’ Concert Film Coming To Streaming Soon?	'Renaissance: A Film by Beyoncé' opened with $27.4 million in its first weekend in theaters. Here's when the Beyhive may be able to stream the concert movie at home.							Renaissance	Streaming
Lily Gladstone Champions Undistributed ‘Fancy Dance’ and ‘Killers of the Flower Moon’ at IndieWire Honors	"Instead of only touting ""Killers of the Flower Moon,"" Gladstone heralded the Indigenous drama ""Fancy Dance"" as the highlight of her career. The 2023 Sundance premiere still doesn't have a U.S. distributor."							KOTFM	Awards
Does The Hunger Games: The Ballad Of Songbirds & Snakes Have A Post-Credits Scene?	The Hunger Games franchise is back, but is there a Ballad of Songbirds &amp; Snakes post-credits scene teasing what's next for Snow and Lucy Gray?							HG	Plot
'Killers of the Flower Moon' Named Best Film by National Board of Review	Lily Gladstone and Martin Scorsese also picked up honors, and will be feted on Jan. 11 in New York							KOTFM	Awards
Why De Niro Paddles DiCaprio In Killers Of The Flower Moon Explained By Scorsese	Martin Scorsese explains why he felt it necessary to show Robert De Niro's character paddling Leonardo DiCaprio in Killers of the Flower Moon.							KOTFM	Plot
The Mail	Letters respond to Michael Luo’s review of a biography of Mitt Romney, Nikhil Krishnan’s review of “Determined,” by Robert M. Sapolsky, and Michael Schulman’s Profile of Ridley Scott.							NR	
‘The Marvels’ Post-Credits Scenes Give Fans Exactly What They Want	"Nia DaCosta's ""The Marvels"" ends with a single post-credits scene, but the path forward it hints at seems destined to change the MCU forever."							Marvels	Plot
The week in entertainment news: Matthew Perry tributes, and Young Sheldon grows up	Over the past few days, the main cast of Friends have all posted individual tributes to late actor Matthew Perry, which have ranged from hilarious to heartbreaking and everything in between. These heartfelt messages come after a short silence while the cast “…							NM	
The Marvels Credit Scene (And That Surprise Character Cameo) Explained	Stay in your seat when the credits start rolling on The Marvels, because the post-credits scene teases a major shake-up for the MCU.							Marvels	Plot
‘Renaissance: A Film by Beyoncé’ Tuning Up For $30M+ Global Opening – Box Office Preview	Refresh for more….AMC’s second concert movie theatrical release, Renaissance: A Film by Beyonce, hoping to liven up what is typically a dull frame at the box office –the post Thanksgiving/early December downer corridor– with what’s look like a $30M, maybe $40…							Renaissance	Box
The Five Nights At Freddy's Movie Finally Put A Bonnie Debate To Rest	Five Nights at Freddy&amp;#39;s Fans have been arguing the true color of Bonnie the bunny for years, but the movie finally puts an end to the blue vs. purple debate.							FNAF	Plot
Camerimage Festival Director Shares Statement About Adam Driver’s Viral Expletive Response During ‘Ferrari’ Audience Q&A	Adam Driver’s lowkey visit to Poland’s EnergaCamerimage Film Festival turned into a viral meme over the weekend after the actor gave an expletive response to a question during an audience Q&A following a screening of Ferrari.  Marek Zydowicz, the festival’s d…							NM	
