title	description	coder 1	movie 1	topic 1	coder 2	movie 2	topic 2	final movie	final topic
'Napoleon' is a hit with the box office, but not so much with critics	"Ridley Scott and David Scarpa's ""Napoleon"" for Apple TV+ has been praised as a masterpiece and mocked as a joke, but its early Thanksgiving opening saw it beat ""Killers of the Flower Moon"" at the box office.Image Credit: Apple""Napoleon"" has just begun its the…"							Napoleon, KOTFM	Box
The Marvels: How many post-credits scenes are there in the latest MCU movie?	With every MCU movie, fans have to know: Does it have an end credits scene? DT reveals how many post-credits scenes The Marvels has and who shows up at the end.							Marvels	Plot
Brendan Fraser Finds In His First Major Role Post-Oscar Win With Searchlight’s ‘Rental Family’	EXCLUSIVE: After taking his time in finding his next big role after winning this years best actor Oscar, Brendan Fraser looks to have zeroed in on that role as sources tell Deadline he is set to star in Searchlight’s Rental Family. Beef helmer Hikari will dir…							NM	
Box Office Results: Hunger Games Snakes by Napoleon and Wish	Snow lands on top! The Hunger Games: The Ballad of Songbirds & Snakes topped the Thanksgiving box office in its second weekend, hauling in $28.8 million (3-day, -35%) and $41.1M (5-day) to bring its domestic total to $98.3M per Deadline. The prequel remained …							HG, Napoleon, Wish	Box
“The Hunger Games: The Ballad Of Songbirds & Snakes” Lands in Los Angeles at Last	And in full force! The post “The Hunger Games: The Ballad Of Songbirds & Snakes” Lands in Los Angeles at Last first appeared on Go Fug Yourself.							HG	Promo
John Woo Gives His Take On Superhero Films: “I Prefer Martin Scorsese’s Movies”	John Woo is giving his take on superhero movies and making it clear he’s not in favor of the films coming out of Marvel and DC Studios. In a new interview, Woo was asked to weigh on about recent movies he’s liked and is asked for his thoughts on comic book-ba…							NM	
Beyoncé's Concert Film Is Heading For An Impressive Box Office Debut	Beyonce's much-anticipated concert film, Renaissance: A Film by Beyonce, may earn one of the biggest opening weekends in December in history.							Renaissance	Box
'The Marvels' review: A chaotic cosmic headache	Marvel Studios' latest movie, The Marvels, exhibits all the symptoms of a rusty creative process. Despite some sparse bursts of charm, it lacks quality control.							Marvels	Plot
How Godzilla Minus One's Creature Is Different From The Monsterverse's Titan Explained By Director	Godzilla Minus One writer-director Takashi Yamazaki explains how the new movie's depiction of Godzilla differs from the American Monsterverse.							Godzilla	Plot
10 Most Visually Stunning Movies Of 2023	2023 brought a lot of visually stunning movies to the world, but 10 of them stand out for the remarkable spectacles they managed to create.							NM	
‘Killers Of The Flower Moon’ Set To Receive Palm Springs International Film Festival’s Vanguard Award	With the SAG strike behind us, the all-important film festivals that occur right in the heart of awards season are starting to take shape. A key stop is always the Palm Springs International Film Festival gala, which has just announced its first award, the Va…							KOTFM	Awards
Where Does Iman Vellani Think Marvel Can Improve? Start With The Fandom [Exclusive]	The Marvels star Iman Vellani has faith in the Marvel Cinematic Universe. If only the fans would &amp;#39;let them cook.&amp;#39;							Marvels	Plot
Scary First Trailer for Angry Imaginary Friend Horror Film 'Imaginary'	Maybe we shouldn't play together anymore, Chauncey!! Blumhouse + Lionsgate have revealed the first official trailer for a horror movie titled Imaginary, materializing in theaters in March next year. Not to be confused with the other 2024 movie starring Emil…							NM	
Is ‘The Hunger Games: The Ballad Of Songbirds & Snakes’ Streaming on Netflix or Prime Video?	It's almost time for the highly anticipated Hunger Games prequel.							HG	Streaming
'Hunger Games' prequel tramples 'Trolls' in box office battle royale, scores $44 million	The Hunger Games: The Ballad of Songbirds & Snakes outduels 'Trolls Band Together' to secure the box office title. The film debuts to $44 million, the lowest for any 'Hunger Games' installment.							HG, Trolls	Box
Ridley Scott Used Multiple Cameras While Filming ‘Napoleon’	Director Ridley Scott has revealed that he always uses at least four cameras while making movies and says his technique paid off for his latest historical epic, Napoleon. [Read More]							Napoleon	Prod
Martin Scorsese’s Family Pictures	On the the problem of love in Killers of the Flower Moon (2023).							KOTFM	Plot
Taylor Swift Supports Friend Emma Stone at 'Poor Things' Premiere After Person of the Year Reveal	Taylor Swift is attending her second movie premiere in as many weeks, and she’s supporting another famous friend in the process. The 33-year-old Midnights pop titan just hit the red carpet at Beyonce‘s Renaissance: A Film By Beyonce premiere in London, Englan…							Renaissance	Promo
Disney CEO Explains Why He Believes The Marvels Fell Short At The Box Office	The newest MCU movie, The Marvels, debuted this month and had the slowest start at the box office in the history of the MCU. Disney CEO Bob Iger recently discussed the film's commercial shortcomings, saying the poor results were due, in part, to a lack of exe…							Marvels	Box
Who Rules the Box Office? Beyoncé, Godzilla, and a Hindi-Language Thriller	"As ""Wish"" and ""The Marvels"" find new depths, salvation comes in the form of left-field releases from once-fringe players."							Renaissance, Godzilla, Marvels, Wish	Box
Here are all the MCU movies and shows you need to watch before The Marvels	Need a crash course on what's happening at Marvel before The Marvels? Then check out these MCU movies and shows so you can be ready for Captain Marvel's sequel.							Marvels	Plot
Godzilla Minus One Posters Giveaway for the Explosive Kaiju Movie	ComingSoon is holding a Godzilla Minus One poster giveaway to celebrate the release of Toho‘s explosive new kaiju movie. We have 15 posters of four different prints for the film to give away as part of the contest. Godzilla Minus One is now playing in theater…							Godzilla	Promo
Godzilla X Kong: The New Empire Trailer Reveals A Titanic Monster Tag Team	The kings of the Monsterverse are back in a new trailer, as Godzilla and Kong find themselves facing a new and mysterious threat in 2024. Godzilla X Kong: The New Empire sees both of the titans team up to take on this hostile force, and it looks like they've …							NM	
Godzilla Minus One Figure Revealed by Super7, Toho International	Super7 and Toho International are partnering together to release a brand new Godzilla figure in celebration of the upcoming Toho film Godzilla Minus One. The new figure will be a part of Super7’s Ultimates line, a line of premium figures that aim to deliver h…							Godzilla	Promo
‘Wish’ Had One Of Disney’s Worst Openings Ever For An Animated Movie—Here’s Why	“Wish” follows Disney’s “Indiana Jones and the Dial of Destiny” and “The Marvels” as another critical and financial disappointment this year.							Wish, Marvels	Box
'The Hunger Games: The Ballad of Songbirds & Snakes' Is The Best Film In The Franchise	Stop me if this one sounds familiar--The Hunger Games have outlived their usefulness. We're over it. The first few were lots of dark fun, but they stretched our appreciation past the breaking point by the time the last one limped... Read more...							HG	Plot
THE HUNGER GAMES: THE BALLAD OF SONGBIRDS AND SNAKES Los Angeles Premiere Red Carpet Rundown	We had to give the spotlight treatment to fellow attendees Viola Davis (because she’s fabulous) and Rachel Zegler (because we think we hate her dress), but make no mistake, plenty of other looks were served on the red carpet the LA premiere of The Hunger Game…							HG	Promo
London Premiere of THE HUNGER GAMES: THE BALLAD OF SONGBIRDS & SNAKES	Tom Blyth, Hunter Schaeffer, Rachel Zegler and Josh Andrés Rivera were all smiles on the red carpet at the London premiere of The Hunger Games: The Ballad of Songbirds and Snakes, possibly because the SAG AFTRA strike has ended but probably because they clear…							HG	Promo
Does Marvel Have a Gen-Z Problem? Just 19% of ‘The Marvels’ Audience Was 18-24	"Just 19 percent of ""The Marvels"" audience was 18-24; compare that to 40 percent for ""Captain Marvel."""							Marvels	Box
‘The Hunger Games: The Ballad Of Songbirds & Snakes’ Begins With Thursday Previews Around $6M – Box Office	EXCLUSIVE: Lionsgate’s prequel The Hunger Games: The Ballad of Songbirds & Snakes is looking at a Thursday night between $5.75M-$6M after showtimes that began at 3PM. Again, these numbers aren’t from the studio and we could see a slightly different result by …							HG	Box
Thanksgiving Box Office: S&S stays on top, Wish bombs, Napolean beats expectations	Box Office: Disney's 'Wish' Fizzles, 'Napoleon' Beats Expectations as 'Hunger Games' Lands on Top Again https://t.co/jFJ2b5Z3aV — Variety (@Variety) November 26, 2023The Hunger Games: The Ballad of Songbirds and Snakes kept its #1 position, grossing $42 mill…							Wish, Napoleon, HG	Box
Lily Gladstone shares her own message of support for Killers Of The Flower Moon audiences	One of the most fascinating things about the public reception to Martin Scorsese’s latest, Killers Of The Flower Moon, has been the ways the people involved in making it—most notably, the Native people who Scorsese cast, consulted with, and otherwise worked w…							KOTFM	Promo
The Hunger Games: The Ballad of Songbirds & Snakes	A surprisingly suspenseful prequel.							HG	Plot
The Marvels Just Had The Biggest Second Weekend Drop Ever For A Superhero Movie	The Marvel Cinematic Universe is good and truly in trouble, with The Marvels collapsing at the box office in its second weekend.							Marvels	Box
Godzilla Minus One Breaks Multiple Box Office Records	Godzilla Minus One breaks multiple box office records during its opening weekend, cementing its place as a very successful Godzilla film.							Godzilla	Box
The Best Part Of Killers Of The Flower Moon May Make Incredible Oscars History In 2024	Killers of the Flower Moon is a strong contender for multiple Academy Award nominations, with the potential for one Oscar win to make history.							KOTFM	Awards
The 20 Oscar Visual Effects Finalists + AFI list	‘Rebel Moon,’ ‘Barbie’ and ‘Wonka’ Among 20 Oscar Visual Effects Finalists (EXCLUSIVE) https://t.co/XOZWL8SktT — Variety (@Variety) December 7, 2023 In quite the award season shocker, Oppenheimer did not make the Oscar Visual Effects short list Variety someh…							NM	NR
The Hunger Games: The Ballad of Songbirds & Snakes Interview: Producer On Coriolanus Snow Lore	The Hunger Games: The Ballad of Songbirds &amp; Snakes producer Nina Jacobson discusses Coriolanus Snow, Hunger Games lore, and practical locations.							HG	Promo
Killers Of The Flower Moon Is The Good Version Of Gangs Of New York	Though longer and more epic, Martin Scorsese&amp;#39;s Killers of the Flower Moon plays out like a much more streamlined and powerful version of his Gangs of New York.							KOTFM	Plot
The Hunger Games Tops The Box Office, But Lionsgate Isn't Partying Like It's 2012	The Hunger Games: The Ballad of Songbirds &amp; Snakes easily topped the box office, but it wasn&amp;#39;t as big of a hit as previous Hunger Games movies.							HG	Box
Napoleon: Two Centuries of Life After Death	Revolutionary soldier or tyrannical emperor? The question is as pertinent now as when Napoleon Bonaparte died in exile on remote Saint Helena in 1821.							NR	
Atom Tickets: The Hunger Games: The Ballad of Songbirds & Snakes Movie Tickets B1G1 Free	Atom Tickets is offering Buy 1 Get 1 Free Movie Tickets for The Hunger Games: The Ballad of Songbirds & Snakes w/ promo code QUEUE applied at checkout.Note, add a quantity of 2 movie tickets to ca ...							HG	Promo
Next Goal Wins Feels Like A '90s Throwback, But It Forgot One Crucial Component	Taika Waititi built his career on making great hang out films featuring memorable characters. With Next Goal Wins, he abandoned that approach - and it cost him.							NM	
The Hunger Games: The Ballad of Songbirds & Snakes Review: A Jaw-Dropping Prequel	Welcome to the 10th Annual Hunger Games. Years after we last visited this franchise with The Hunger Games: Mockingjay – Part 2, it’s time to return to Panem for a story that takes place decades before Katniss Everdeen volunteered as tribute. The Hunger Games:…							HG	Promo
The Marvels Ending And Mid-Credits Scene Explained	After several months of delay, Marvel's The Marvels has landed in movie theaters. Despite being the shortest movie in the Marvel Cinematic Universe thus far, The Marvels leaves quite an impact--the ending sets up two separate major plot threads for the future…							Marvels	Plot
If There's a Thor 5, Taika Waititi Won't Be Part of It	In one of those rare cases where the rumor mills are actually accurate, director Taika Waititi confirmed that if Marvel Studios decides to make a fifth Thor movie, he won’t be involved. “I wouldn’t know if that’s [a Thor 5 happening] accurate,” Waititi said t…							NM	
Martin Scorsese to Be Honored with David O. Selznick Achievement Award at 2024 PGA Awards	"The Producers Guild of America announced that the ""Killers of the Flower Moon"" filmmaker will receive the prestigious David O. Selznick Achievement Award at the 35th annual Producers Guild Awards."							KOTFM	Awards
'The Marvels' Has A Far From Marvelous N.America Opening	"New superhero film ""The Marvels"" is making history, and not in a good way: its estimated $47 million North American take over the weekend marks the lowest debut ever for a movie from Disney's normally money-cranking Marvel Cinematic Universe."							Marvels	Box
Apple Original Films’ ‘Killers of the Flower Moon,’ from Martin Scorsese, available to rent or buy on December 5th	On the heels of “Killers of the Flower Moon” being named Best Film of 2023 and Lily Gladstone being awarded Best Actress by the… The post Apple Original Films’ ‘Killers of the Flower Moon,’ from Martin Scorsese, available to rent or buy on December 5th appear…							KOTFM	Streaming
'Killers of the Flower Moon' gets digital release before Apple TV+ streaming debut	"Potential viewers of the Martin Scorsese-directed ""Killers of the Flower Moon"" have a bit longer to wait to watch the film on Apple TV+, but it will be made available to buy and rent digitally ahead of its streaming service release.Lily Gladstone and Leonardo…"							KOTFM	Streaming
What Did Steven Spielberg Have to Say About 'Killers of the Flower Moon'?	As the studios prepare to roll out their Academy Award campaigns, the major benefit we get as fans and filmmakers is the interviews. I love hearing the process behind how movies come together, and I love it when other famous filmmakers join in the conversatio…							KOTFM	Promo
Leonardo DiCaprio Attends Robbie Robertson's Celebration of Life with 'Killers of the Flower Moon' Collaborators	Leonardo DiCaprio shows his support at the Robbie Robertson: A Celebration of His Life And Music event held at The Village Studios on Wednesday (November 15) in Los Angeles. If you don’t know, Robbie passed away this past August at the age of 80. Robbie and M…							KOTFM	NR
Christopher Nolan Defends the Role of Franchises in Hollywood: A Healthy Film Industry Needs ‘A Balance’	"Nolan responded to Martin Scorsese's recent comments calling for prominent filmmakers to ""fight back"" against the prevalence of comic book movies."							NM	
The 10 Best Movies of 2023	From 'Past Lives' to 'Killers of the Flower Moon,' see TIME's picks for the best movies of the year.							KOTFM	Plot
Why We’re Still So Obsessed With Napoleon	David A. Bell explores the many sides of Napoleon, and how his story should remind us of the darkness that humans are capable of—not just the grand adventures.							NM	
Martin Scorsese explains [REDACTED]’s Killers Of The Flower Moon cameo	I was taken by the impact of the realization that all of this is reduced to a half-hour piece of entertainment							KOTFM	Plot
‘The Hunger Games: The Ballad Of Songbirds & Snakes’ Devours $99M Global Opening; ‘Trolls Band Together’ Tops $100M WW – International Box Office	Refresh for latest…: Lionsgate’s The Hunger Games: The Ballad of Songbirds & Snakes very (very) narrowly missed the $100M mark globally in its opening weekend, but it’s as near as dammit with an estimated $98.5M through Sunday worldwide. The Francis Lawrence-…							HG, Trolls	Box
Here’s Why Taylor Swift Didn’t Attend Beyoncé's Movie Premiere After Bey’s Surprise 'Eras Tour' Premiere Appearance	Taylor Swift is missing the premiere of Beyonce‘s new movie Renaissance: A Film By Beyonce on Saturday night (November 25), but she has a very good reason. If you forgot, the “Break Me Soul” superstar was a surprise celebrity guest on the red carpet when Tayl…							Renaissance	Promo
Spirit Awards Analysis: Noms Advance Oscar Contenders ‘American Fiction,’ ‘May December,’ ‘Past Lives’	Forward momentum helps: The Film Independent Spirit Award honorees and Oscars could share some overlap this season.							NM	
Napoleon conquers Wish but gets exiled by the Hunger Games prequel	November 2023: Napoleon is master of the domestic box office. Only The Hunger Games: The Ballad Of Songbirds & Snakes stands before it. Oceans are now battlefields. Or, you know, close enough. Ridley Scott’s Napoleon has successfully defeated every other movi…							Napoleon, Wish, HG	Box
What Critics And Fans Are Saying About The Marvels	2023 has been a rough year for the MCU, but does The Marvels end things on a high note? Here&amp;#39;s what critics and fans are saying about the film.							Marvels	Plot
Did Josephine Actually Love Napoleon? Ridley Scott Has Thoughts	Were Napoleon Bonaparte (played by Joaquin Phoenix) and Jos&eacute;phine de Beauharnais (played by Vanessa Kirby) really in love? Ridley Scott has thoughts.							Napoleon	Plot
Godzilla Minus One review: The monster roars louder than ever	Nearly 70 years and more than 35 films into the series, it’s a testament to the enduring appeal of a skyscraper-sized lizard that Godzilla movies can still surprise you. He may not be the most flexible nuclear-powered dinosaur, but the concept is undeniably m…							Godzilla	Plot
Deadline Launches Streaming Site For Sound & Screen: Film	The 2023 edition of Deadline’s live-music event Sound & Screen: Film hit the stage November 9 showcasing the songs and scores from 12 of the ramping-up awards season’s buzziest movies. Panelists and performances came from the likes of Diane Warren and Mark Ro…							NM	Awards
Leonardo DiCaprio's Top 10 Highest-Grossing Movies (They All Made Over $100 Million!)	Leonardo DiCaprio has had himself quite the career, appearing in many lucrative films! The 49-year-old actor recently starred in Martin Scorsese‘s Killers of the Flower Moon, which has brought in $66.5 million domestically. Over the years, Leo has garnered a …							KOTFM	NR
Gotham Awards Winners List – Updating Live	The Gotham Awards, among the first of the movie-kudos season, is underway at Cipriani Wall Street in Manhattan. Deadline will be updating the winners list as they are announced. The first trophy of the night went to Anatomy of a Fall for Best Screenplay, penn…							NM	
Here's how to watch Killers of the Flower Moon at home today — rent or buy	Killers of the Flower Moon is available on streaming today, but not on Apple TV Plus like we all expected.							KOTFM	Streaming
Hunger Games Wins Thanksgiving Weekend Box Office	Hunger Games: The Ballad of Songbirds & Snakes held off some stiff competition this holiday box office weekend to stay number one. The prequel added $42 million over the five-day holiday period, Pushing it close to the $100 million mark in its first two weeke…							HG	Box
AFI Names 10 Best Films and TV Series of 2023: ‘Barbie,’ ‘Past Lives,’ ‘Oppenheimer,’ ‘Succession,’ ‘Beef,’ and More	The American Film Institute has announced its annual AFI Awards, including the best film and TV of the year.							NM	
Taika Waititi's Next Goal Wins Is 2023's Latest Box Office Bomb	Despite its low budget, Taika Waititi&amp;#39;s delayed sports comedy Next Goal Wins is unlikely to recoup its costs at the box office. But what went wrong, exactly?							NM	
The Ballad of Songbirds & Snakes might be the best Hunger Games movie yet	The Hunger Games: The Ballad of Songbirds & Snakes finds a new wrinkle in a story we thought we knew.							HG	Plot
Godzilla Minus One Sequel Chances Following Shocking Ending Reveal Addressed By Director	Godzilla Minus One director, writer, and visual effects designer Takashi Yamazaki addresses the possibility of the new monster movie getting a sequel.							Godzilla	Plot
‘Hunger Games: Ballad Of Songbirds & Snakes’: Spotify A Key Partner In Country Music Infused Prequel	Music has continually been a facet of Lionsgate‘s $3 billion Hunger Games franchise going back to ditties from Taylor Swift, Coldplay and Lorde, and with today’s theatrical release of Lionsgate’s The Hunger Games: The Ballad of Songbirds & Snakes, the studio …							HG	Prod
Olivia Rodrigo Drops ‘Can’t Catch Me Now’ Music Video For ‘The Hunger Games: The Ballad Of Songbirds & Snakes’ Soundtrack	Olivia Rodrigo is contributing her music to the soundtrack for The Hunger Games: The Ballad of Songbirds & Snakes with “Can’t Catch Me Now.” The High School Musical: The Musical: The Series alum attended the premiere of the film in L.A. as her music video als…							HG	Prod
Killers of the Flower Moon Digital & PVOD Release Date Announced	Paramount Home Entertainment has announced the Killers of the Flower Moon digital release for Martin Scorsese’s newest crime drama epic starring Leonardo DiCaprio and Lily Gladstone. This comes after over a month since the film’s October 20 wide release. Kill…							KOTFM	Streaming
Tina Knowles Posts Sweet Moment Beyonce & Blue Ivy Shared on Red Carpet at London Premiere	Beyonce and Blue Ivy shared a precious moment on the red carpet, and Tina Knowles is posting it for the world to see! If you were unaware, the “Break My Soul” icon is in London, England for the premiere of her movie Renaissance: A Film By Beyonce on Thursday …							Renaissance	NR
‘Killers Of The Flower Moon’ Star Lily Gladstone Warns Indigenous Viewers Of Film’s Traumatic Impact	Killers of the Flower Moon star Lily Gladstone is encouraging Indigenous viewers to watch the Martin Scorsese film “when and only if you feel ready.” The film looks at 1920s Oklahoma and the murder of dozens of the Osage people in an attempt to steal their we…							KOTFM	Plot
Napoleon Box Office Prediction: Will It Flop or Succeed?	Joaquin Phoenix’s Napoleon hits the theaters soon, and fans wish to find out how it will perform at the box office. Will the latest Apple TV movie flop, or will it succeed? Here’s a prediction based on the current projections. How Much Money is Napoleon predi…							Napoleon	Box
Napoleon Bonaparte's hat to go on sale at Paris auction	The black bicorne felt hat was a trademark of the French emperor, and is expected to fetch up to €800,000.							NR	
Saturday assorted links	1. “The World Bank estimates that crime costs South Africa 10% of GDP annually.”  Link here. 2. An analysis of Geert Wilders.  People don’t like deductibles! 3. An unreasonable and offensive rant against Millennials. 4. Advance raves for Godzilla Minus One.  …							NR	
Teen Dystopian Movies Ranked, From ‘The Hunger Games’ to ‘Divergent’	As ‘The Hunger Games: The Ballad of Songbirds & Snakes’ enters the canon, a ranking of postapocalyptic movies adapted from dystopian YA novels—from the utterly bleak to the genre peak.							HG	Plot
7 Box Office Records Broken By Godzilla Minus One	Godzilla Minus One has been a massive commercial success since its release, and here are all seven box office records the film has broken so far.							Godzilla	Box
These Are Fans' 10 Favorite Leonardo DiCaprio Movies (& 'Titanic' Doesn't Even Make the List!)	Cinephiles have shared their opinions about Leonardo DiCaprio‘s movies! The Oscar-winning actor burst onto the Hollywood scene in the 1990s with his roles in What’s Eating Gilbert Grape and Titanic, which catapulted Leonardo to the A-list status he has retain…							NM	
‘Renaissance: A Film By Beyoncé’ Brightens Up Thursday With $5M Previews; 99% Positive Audience Exits – Box Office	AMC Entertainment’s second concert film theatrical release, Renaissance: A Film by Beyonce, fired up last night with $5M previews from showtimes that began at 7PM. While that figure is higher than the Thursday night previews for AMC’s Taylor Swift: The Eras T…							Renaissance	Box
What went wrong with The Marvels? 5 reasons why the MCU is in trouble	After a disastrous opening reception, many are asking this question: What went wrong with The Marvels? Here are 5 reasons why the latest MCU movie flopped.							Marvels	Box
The Marvels Pays Off The Worst Part Of Secret Invasion Ending (Kind Of)	Secret Invasion never really explained why Skrulls couldn&amp;#39;t have a place of their own on Earth like New Asgard, and The Marvels actually rectifies that.							Marvels	Plot
