title	description	coder 1	movie 1	topic 1	coder 2	movie 2	topic 2	final movie	final topic
Martin Scorsese’s Killers of the Moon hits Apple TV+ December 5	Apple’s original critically-acclaimed film Killers of the Moon hits Apple TV+ on December 5th. Killers of the Flower Moon is a 2023 American western crime drama based on the 2017 non-fiction book of the same name. It’s set in 1920s Oklahoma and focuses on the…							KOTFM	Streaming
‘Killers Of The Flower Moon’ Named Best Film By The National Board Of Review	Martin Scorsese’s Western historical epic Killers of the Flower Moon on Wednesday was named Best Film by the National Board of Review, the second major awards honor for the Apple Original Films pic this week after it also won the top prize from the New York F…							KOTFM	Plot
A Little Race War	Martin Scorsese’s Killers of the Flower Moon says the usual things about America’s racial demons, and says some of them well. The post  A Little Race War appeared first on The American Conservative.							KOTFM	Plot
The Hunger Games Prequel Movie Popcorn Bucket: Where to Buy the Container & Cup?	As the theatrical release of The Hunger Games: The Ballad of Songbirds & Snakes is approaching, fans want to know where they can get their hands on the film’s limited edition popcorn bucket and cup. Here is all you need to know. Where to buy The Hunger Games:…							HG	Promo
Killers of the Flower Moon Writer Hired by Denis Villeneuve for Mystery Space Movie	Killers of the Flower Moon writer Eric Roth recently revealed that he has written a mysterious movie for Dune director Denis Villeneuve. During a recent appearance on the “A Script Apart” podcast, Roth said that he isn’t sure what will happen with the project…							KOTFM	NR
How Much The Hunger Games: The Ballad Of Songbirds & Snakes Cost To Make & What Box Office It Needs	The Ballad of Songbirds &amp; Snakes continues the Hunger Games franchise story. Is it expected to do well at the box office? We break down the numbers.							HG	Box
Boosie Badazz Enraged By 'Killers Of The Flower Moon' Movie: 'This P-sses Me The F-ck Off'	"Boosie Badazz shared his thoughts on Martin Scorsese's 'Killers of the Flower Moon,' revealing he ""hated"" the contents of the movie."							KOTFM	Plot
Trolls Band Together Review: Slick But Soulless Production Still Appeals To Kids	Trolls Band Together shows clear signs of franchise fatigue, but a few new songs and vivid animation choices keep it afloat a little longer.							Trolls	Plot
"Five Nights At Freddy's 2's ""Even Bigger"" Plan Teased By Villain Actor: ""I'm Excited To See When They Greenlight [It]"""	A Five Nights at Freddy's star expresses his excitement over the potential for Five Nights at Freddy's 2 to be even bigger and more successful.							FNAF	NR
Trolls Band Together Review	Justin Timberlake and Anna Kendrick's high-energy mash-ups are starting to sound the same.							Trolls	Plot
Robert De Niro Blasts Apple for Editing Gotham Awards Speech	Apple apparently removed a political portion of De Niro's speech without his knowledge. Robert De Niro Blasts Apple for Editing Gotham Awards Speech Scoop Harrison							NR	
Only One 2023 Movie with a Budget Over $200 Million Has Made a Profit (So Far) This Year	"And there's no assurance that others will follow suit. As ""Wish"" and ""Napoleon"" join the $200 Million Club, we examine the increasingly slippery slope of making money on very big-budget movies."							Napoleon, Wish	Box
Is Godzilla Minus One The Best Godzilla Movie? 10 Biggest Takeaways From Reviews	Godzilla Minus One has garnered rave reviews from critics and fans, and its reviews provide insight into the reasons why it's been so well-received.							Godzilla	Plot
The big questions we had after The Marvels, and a few answers	What was up with Dar-Benn (not Darbin!), Maria Rambeau, Monica’s costume, Captain Marvel’s MCU timeline, the Secret Invasion connections, and more.							Marvels	Plot
Timothée Chalamet Sings of a ‘World of Shameless Self-Promotion’ Post-Strike and Is a Sleep Demon Troye Sivan on ‘SNL’	"The episode's standout features Chalamet as the ""gay-famous"" Australian pop star."							NR	
Every Godzilla film, ranked from worst to best	Across four eras—Showa, Heisei, Millenium, and Reiwa—Godzilla has helped chart the course of both a country and a culture, speaking to the fears, hopes, and most fantastical dreams of the Japanese people. Toho’s Godzilla films have captivated the world for ne…							NM	Plot
In the ‘Hunger Games’ of Box Office, ‘Napoleon’ and ‘Wish’ Fall Short of #1 on a Holiday Weekend	"Ridley Scott's epic surprisingly topped Disney Animation's latest for #2. Netflix may not be willing to acknowledge it, but ""Maestro"" may represent its best platform opening in years."							HG, Napoleon, Wish	Box
Bold Speeches from Auteurs and Comfy Couches: IndieWire Honors 2023 Is the Awards Show Like No Other	"Honorees like Todd Haynes and Greta Gerwig reflected on the start of their careers, while actress Lily Gladstone uplifted Erica Tremblay's ""Fancy Dance."""							NR	
Napoleon Is a Big, Messy Pageant, With Joaquin Phoenix as Its Dad-Humor Emperor	Ridley Scott's historical epic is sometimes boring and pretentious and often a little silly, but there's still something compelling about it. Read TIME's review.							Napoleon	Plot
Godzilla Minus One Clip Shows Titular Kaiju Chasing a Tugboat	A brand new Godzilla Minus One clip from Toho’s latest live-action Godzilla movie has been released. It features an extended look at one of the action-packed sequences teased in previous trailers. The video shows the titular Kaiju terrorizing a group of men o…							Godzilla	Promo
‘Godzilla Minus One’ Review: Toho’s Franchise Return Breathes Exciting New Life Into Japan’s Biggest Star	After countless variations and sequels, plus major studio Hollywood versions, Toho is back in the driver’s seat for the first time since 2016 with a new take on the 70-year-old Godzilla franchise, a consistent run far longer than Bond and just about anything …							Godzilla	Plot
One Of Five Nights At Freddy's Animatronics Caught Fire While Filming	Talk about scary: on the set of the Five Nights at Freddy&amp;#39;s movie, one of the animatronics ended up catching fire. Yikes!							FNAF	NR
‘The Marvels’ Makes Box Office History, ‘The Hunger Games’ Eyes #1 Spot	"What cost ""The Marvels"" the box office crown for November, and will ""The Hunger Games: The Ballad of Songbirds and Snakes"" become the month's box office royalty?"							Marvels, HG	Box
Martin Scorsese Hosts Robbie Robertson Tribute Concert, With Jackson Browne and Others Paying Musical Homage	In honor of the late Robbie Robertson, whose “Killers of the Flower Moon” score was his final work, Martin Scorsese hosted a private tribute concert Wednesday in Los Angeles that had guests including Joni Mitchell, Leonardo DiCaprio and Lily Gladstone watchin…							KOTFM	NR
Anna Kendrick And ‘Trolls Band Together’ Filmmakers On Nearly A Decade Of Toon Tunes – Contenders Film L.A.	“I think I didn’t realize how lucky I got with this team,” franchise star Anna Kendrick said about DreamWorks Animation’s Trolls Band Together. Speaking at Deadline’s Contenders Film: Los Angeles event, the Oscar nominee said, “I have other friends who have d…							Trolls	Prod
Beyoncé’s Renaissance Movie Tops U.S. Box Office in Its Opening Weekend	In its first weekend, the concert film bested The Hunger Games: The Ballad of Songbirds & Snakes and Godzilla Minus One	Tristan	Renaissance, HG, Godzilla	Box	Michael	Renaissance, HG, Godzilla	Box	Renaissance, HG, Godzilla	Box
What’s new on VOD and Digital in December 2023	What's new on VOD and Digital in December 2023? Killers of the Flower Moon, Taylor Swift: The Eras Tour, Trolls Band Together, It’s a Wonderful Knife, and more.	Tristan	Trolls, KOTFM	Streaming	Michael	KOTFM, Trolls	Streaming	KOTFM, Trolls	Streaming
The Marvels Drama, Fallout TV Show Reveals, and More Top Pop Culture News of the Week	It’s been a wild week in the world of sci-fi, fantasy, superheroes, and more genre fare. The return of Doctor Who for its 60th anniversary, burning Mandalorian questions, and our epic first looks at Fallout and Furiosa all made the list of our most read stori…	Tristan	Marvels	NR	Michael	Marvels	NR	Marvels	NR
Beyoncé defeats Godzilla Minus One to claim the weekend box office crown	Move over superhero movies, the hot new thing in American cinemas is apparently concert films. After Taylor Swift: The Eras Tour made nearly $180 million over the last eight weeks, Beyoncé has arrived to do her part in taking over the theater industry. Renais…	Tristan	Renaissance, Godzilla	Box	Michael	Godzilla	Box	Godzilla	Box
The Hunger Games: The Ballad of Songbirds & Snakes: what to watch before the new movie	In the latest episode of Binge Club, our experts tell you everything you need to watch ahead of the newest Hunger Games flick	Tristan	HG	Promo	Michael	HG	Promo	HG	Promo
May the weekend box office be ever in The Ballad Of Songbirds And Snakes’ favor	After a couple of slow weekends at the domestic box office, things have bounced back nicely thanks to four pretty big new releases that mostly did okay (and one movie with a limited rollout that did relatively good). The biggest of those big new releases is H…	Tristan	HG	Box	Michael	HG	Box	HG	Box
The Mail	Readers respond to Emma Green’s piece about New York’s teacher-certification requirements, Jackson Arn’s review of “Manet/Degas,” and Anthony Lane’s review of “Killers of the Flower Moon.”	Tristan	KOTFM	Plot	Michael	KOTFM	Plot	KOTFM	Plot
Ridley Scott's Napoleon Rides To A $33 Million Debut At The Thanksgiving Box Office	Napoleon is battling Disney&amp;#39;s Wish for second place at the Thanksgiving box office, as Apple Original Films makes another bid for awards season prestige.	Tristan	Napoleon, Wish	Box	Michael	KOTFM, Wish	Box	Napoleon, Wish	Box
De Niro says Apple censored his award show speech, so he read the original from his phone	On Monday night, Robert De Niro took the stage at the Gotham Awards in New York City to introduce an award for Martin Scorsese's Apple film, Killers of the Flower Moon, which De Niro starred in.     When he looked at the teleprompter, he realized the first pa…	Tristan	KOTFM	Awards	Michael	KOTFM	Awards	KOTFM	Awards
‘The Hunger Games: Ballad Of Songbirds & Snakes’ Sings Past $100M At Domestic Box Office	Benchmarks we should celebrate as the marketplace looks to rebound after dual strikes that sidelined the box office: Lionsgate’s The Hunger Games: The Ballad of Songbirds & Snakes has crossed the $100M mark at the domestic box office yesterday in its 11th day…	Tristan	HG	Box	Michael	HG	Box	HG	Box
Godzilla Minus One Is a Terrifying, Hopeful Throwback	Screenshot: Toho Godzilla, and Godzilla movies, has been many things over the past 69 years—the King of All Monsters has changed in character as often as he’s changed in design, from horrifying force of nature to heroic defender of the Earth. It’s fitting th…	Tristan	Godzilla	Plot	Michael	Godzilla	Plot	Godzilla	Plot
Apple’s latest tvOS beta kills the iTunes Movies and TV shows apps	Apple’s latest tvOS beta suggests the iTunes Movies and TV Shows apps on Apple TV are on their way out. 9to5Mac reports the set-top box’s former home of streaming purchases and rentals is no longer in the tvOS 17.2 release candidate (RC), now available to dev…	Tristan	NR		Michael	NR		NR	
‘The Hunger Games: The Ballad Of Songbirds & Snakes’ World Premieres As Team Optimistic For More Sequels	Lionsgate’s The Hunger Games: The Ballad of Songbirds & Snakes had its world premiere at London’s BFI IMAX this evening, with a red carpet that featured director Francis Lawrence and stars Rachel Zegler, Tom Blyth, Hunter Schafer, Josh Andres Rivera and more.…	Tristan	HG	Promo	Michael	HG	Promo	HG	Promo
‘The Hunger Games: The Ballad of Songbirds & Snakes’ Review: The Rare Hollywood Prequel That Towers Over the Rest of Its Franchise	Hollywood's obsession with dystopian YA stories might be over, but the sub-genre's best movie just arrived.	Tristan	HG	Plot	Michael	HG	Plot	HG	Plot
Ridley Scott Points Out He’s Made Four Films Since Martin Scorsese Started ‘Killers of the Flower Moon’	"I get up in the morning and say, 'Ah great! Another day of stress,' the ""Napoleon"" director said."	Tristan	Napoleon, KOTFM	NR	Michael	Napoleon, KOTFM	NR	Napoleon, KOTFM	NR
‘Hunger Games: Ballad Of Songbirds & Snakes’ Looks To Sing $100M+ Worldwide Opening – Preview	In what will be a revived week for moviegoing post actors strike heading into the Thanksgiving holiday, Lionsgate’s The Hunger Games: The Ballad of Songbirds & Snakes is looking to lead a global frame with a $100M+ start. The pic is one of four big studio wid…	Tristan	HG	Box	Michael	HG	Box	HG	Box
Ridley Scott's Napoleon Conquered The World Over Thanksgiving (At The Box Office)	Napoleon grossed $78.8 million worldwide over the Thanksgiving holiday, ranking in first place thanks to a strong overseas performance.	Tristan	Napoleon	Box	Michael	Napoleon	Box	Napoleon	Box
Martin Scorsese Hilariously Admits He’s ‘Tricked Into’ Making TikToks With Daughter Francesca	“I didn’t know those things go viral,” the iconic filmmaker said.	Tristan	NR		Michael	NR		NR	
‘The Marvels’ Debuts Atop U.K., Ireland Box Office as ‘Tiger 3’ Roars	Disney’s “The Marvels” debuted atop the U.K. and Ireland box office with £3.4 million ($4.2 million), according to numbers released by Comscore. However, in keeping with its global bow, the opening was soft as the latest installment in the MCU scored just abo…	Tristan	Marvels	Box	Michael	Marvels	Box	Marvels	Box
How Josh Hutcherson Landed Five Nights At Freddy's Biggest Role	According to director Emma Tammi, Josh Hutcherson immediately grasped what makes the Five Nights at Freddy&amp;#39;s franchise so special.	Tristan	FNAF	Prod	Michael	FNAF	Promo	FNAF	Prod
‘Trolls Band Together’ Gets Psychedelic	"The new sequel features the giant lollipop-looking Velvet (Amy Schumer) and Veneer (Andrew Rannells), and 2D animation inspired by R. Crumb and ""Yellow Submarine."""	Tristan	Trolls	Plot	Michael	Trolls	Prod	Trolls	Plot
It’s Finally Trophy Time for the MFL	‘Past Lives’ won the day at the Gotham Awards, but ‘Killers of the Flower Moon’ and ‘May December’ didn’t go without recognition. Plus, box office breakdowns for ‘Wish’ and ‘The Hunger Games: The Ballad of Songbirds & Snakes.’	Tristan	KOTFM, Wish, HG	Awards	Michael	KOTFM, Wish, HG	Awards	KOTFM, Wish, HG	Awards
A career trend to bet on	The creator economy is too large to ignore. And it's not just influencers cashing in. An industry has built up to support social-media stars.	Tristan	NR		Michael	NR		NR	
Killers Of The Flower Moon is now available to watch at home	If you were nervous about seeing a 206-minute epic with absolutely no intermissions in theaters, or you really wanted to experience Brendan Fraser and his “girth” from the comfort of your own home, today’s your lucky day. Fresh off nabbing both a Best Film wi…	Tristan	KOTFM	Streaming	Michael	KOTFM	Streaming	KOTFM	Streaming
Why ‘Napoleon’ and ‘Spider-Man’ Made the Oscar VFX Long List — and ‘Oppenheimer’ Did Not	"Gareth Edwards' ""The Creator"" is now the frontrunner, with ""Across the Spider-Verse"" as the underdog."	Tristan	Napoleon	Awards	Michael	Napoleon	Awards	Napoleon	Awards
Martin Scorsese's Killers Of The Flower Moon Cameo Was A Perfect Accident	Martin Scorsese has a show stopping cameo in his new film Killers of the Flower Moon, but it almost didn&amp;#39;t happen.	Tristan	KOTFM	Prod	Michael	KOTFM	Prod	KOTFM	Prod
How To Watch Martin Scorsese's Killers Of The Flower Moon At Home	Martin Scorsese fans can experience one of the most devastating and powerful movies of 2023 all over again when Killers of the Flower Moon hits the home market.	Tristan	KOTFM	Streaming	Michael	KOTFM	Streaming	KOTFM	Streaming
‘The Hunger Games’ Star Rachel Zegler Recalls Meeting Jennifer Lawrence Jokingly Wanting To Strangle Her For Photo	Rachel Zegler stars in The Hunger Games: The Ballad of Songbirds & Snakes and recently recalled an encounter she had with OG star Jennifer Lawrence. While making an appearance on The Kelly Clarkson Show, Zegler opened up about meeting Lawrence during the Chri…	Tristan	HG	NR	Michael	HG	Promo	HG	Promo
‘Hunger Games: Ballad Of Songbirds & Snakes’: Spotify A Key Partner In Country Music Infused Prequel	EXCLUSIVE: Music has continually been a facet of Lionsgate’s $3 billion Hunger Games franchise going back to ditties from Taylor Swift, Coldplay and Lorde, and with today’s theatrical release of Lionsgate’s The Hunger Games: The Ballad of Songbirds & Snakes, …	Tristan	HG	Prod	Michael	HG	Prod	HG	Prod
Box Office: ‘Hunger Games’ Prequel Opening to $45M-$50M, ‘The Marvels’ Suffers Historic Drop	Tom Blyth and Rachel Zegler in 'The Hunger Games: The Ballad of Songbirds and Snakes.' Lionsgate’s prequel The Hunger Games: The Ballad of Songbirds & Snakes is headed for a $45 million-plus opening at the domestic box office after earning $19.1 million on Fr…	Tristan	HG, Marvels	Box	Michael	HG, Marvels	Box	HG, Marvels	Box
Apple’s ‘Napoleon’ Sets Thanksgiving Global Box Office Battle Plan Via Sony With $46M WW Start – Preview	EXCLUSIVE: Getting a leg-up here on our Thanksgiving stretch preview, Apple Studios production of Ridley Scott’s Napoleon will invade the global box office via Sony this Wednesday, in what’s shaping up to be a $46M WW global start. Split up for the Wednesday-…	Tristan	Napoleon	Box	Michael	Napoleon	Box	Napoleon	Box
Box Office Results: Beyonce and Godzilla Lead Quiet December Weekend	The first week of December resulted in a relatively quiet box office, albeit with a few pleasant surprises. Among them is Renaissance: A Film by Beyonce, which took the top domestic spot with $22 million, per Deadline. Sure, this latest concert venture is far…	Tristan	Renaissance, Godzilla	Box	Michael	Renaissance	Box	Renaissance, Godzilla	Box
‘Songbirds & Snakes’ Director Francis Lawrence On Finding Tom Blyth; Lead Star Chats Coriolanus Snow’s Next Steps & Lucy Gray Baird’s Whereabouts – Crew Call Podcast	Warning: This podcast contains spoilers about the ending of Lionsgate’s The Hunger Games: The Ballad of Songbirds & Snakes “In 2015, we thought she was done.” That’s what filmmaker Francis Lawrence thought about the finale of the $3 billion-plus grossing The …	Tristan	HG	Plot	Michael	HG	Promo	HG	Promo
Marvel's The Marvels opens at the top of the weekend box office, and let’s leave it at that	It looks like Marvel Studios’ domination of the U.S. box office continues, with The Marvels—the latest entry in the MCU—opening in the number one spot. Of course… it did also manage to have the worst opening weekend in the history of the franchise, as predict…	Tristan	Marvels	Box	Michael	Marvels	Box	Marvels	Box
Leonardo DiCaprio Calls Martin Scorsese a ‘National Treasure’ and His ‘Cinematic Father Figure’	"He's still continuing to make daring, independent films even though they're massive in budget, DiCaprio said of his longtime collaborator behind ""Killers of the Flower Moon."""	Tristan	KOTFM	NR	Michael	KOTFM	Promo	KOTFM	Promo
Robert De Niro Blasts Apple and Gothams for Editing His Anti-Trump Speech on Teleprompter	"The ""Killers of the Flower Moon"" actor called out former president Donald Trump and the ""lies"" in media, saying, ""History isn’t history any more."""	Tristan	KOTFM	NR	Michael	KOTFM	NR	KOTFM	NR
The Ballad of Songbirds & Snakes: Is Jennifer Lawrence’s Katniss in The Hunger Games Prequel?	Fans want to know whether or not Jennifer Lawrence’s Katniss Everdeen is in The Hunger Games: The Ballad of Songbirds & Snakes. Here is all you need to know. However, beware of spoilers. Is Katniss Everdeen in The Hunger Games: The Ballad of Songbirds & Snake…	Tristan	HG	Plot	Michael	HG	Plot	HG	Plot
‘The Marvels’ Will Become the First MCU Title to Fall Short of $100 Million Domestic	"In happier box-office news, ""The Hunger Games: Ballad of Songbirds and Snakes"" opened well while ""Saltburn"" and ""Fallen Leaves"" had strong limited debuts."	Tristan	Marvels, HG, Trolls	Box	Michael	Marvels, HG, Trolls	Box	Marvels, HG, Trolls	Box
‘Killers of the Flower Moon’ Star Lily Gladstone Always Wants to Answer the Tough Questions	"The star of Martin Scorsese's ""Killers of the Flower Moon,"" who is set to receive the Performance Award at IndieWire Honors, walks us through her layered, complex turn as Mollie Burkhart."	Tristan	KOTFM	NR	Michael	KOTFM	Awards	KOTFM	Awards
2023 National Board of Review Winners List: ‘Killers of the Flower Moon’ Leads Top Honors	Maestro director-actor Bradley Cooper is also recognized with the NBR Icon Award.	Tristan	KOTFM	Awards	Michael	KOTFM	Awards	KOTFM	Awards
Five Nights At Freddy's Reignited A Dying Part Of Matthew Lillard's Career	Matthew Lillard has been working steadily since Scream and Scooby-Doo, but Five Nights at Freddy&amp;#39;s brought him back to the big screen.	Tristan	FNAF	NR	Michael	FNAF	NR	FNAF	NR
Breaking Down the Ending of The Marvels	The end of the Marvels suggests that big things are coming to the Marvel Cinematic Universe. Here's what happened and what it all means.	Tristan	Marvels	Plot	Michael	Marvels	Plot	Marvels	Plot
Godzilla Minus One Ending Explained: Long Live The King	Does the ending of Godzilla Minus One set up the possibility for even more films in this story&amp;#39;s timeline? Here&amp;#39;s our explanation.	Tristan	Godzilla	Plot	Michael	Godzilla	Plot	Godzilla	Plot
Napoleon's long and costly invasion of Russia was one of the deadliest military operations in history	In what would be the beginning of the end of his empire, Napoleon Bonaparte invaded Russia with the largest army Europe had ever seen.	Tristan	NR		Michael	NR		NR	
Bob Iger says Disney made too many sequels but he won't apologize for making them	"Referring to ""The Marvels,"" Disney CEO Bob Iger said the movie's poor performance was down to a lack of supervision from executives."	Tristan	Marvels	Prod	Michael	Marvels	Box	Marvels	Box
Can Apple's Napoleon Bring Ridley Scott And Joaquin Phoenix Box Office Glory?	Can Ridley Scott&amp;#39;s Napoleon conquer the box office when it opens over the Thanksgiving holiday? Or will it suffer an epic defeat?	Tristan	Napoleon	Box	Michael	Napoleon	Box	Napoleon	Box
De Niro accuses Apple of censoring his speech honoring Martin Scorsese	Robert De Niro says that Apple or the Gotham Awards cut a political segment including criticisms of Donald Trump out of his teleprompter copy of a speech — so he read the rest from his phone.Actor Robert De Niro presented Martin Scorsese with the Gotham Histo…	Tristan	NM		Michael	NM		NM	
‘Godzilla Minus One’ Is the Best Godzilla Movie in Ages	Going back to basics, Takashi Yamazaki’s ‘Minus One’ is a lean Spielbergian period drama that brings the Toho titan back to its former glory.	Tristan	Godzilla	Plot	Michael	Godzilla	Plot	Godzilla	Plot
November 2023 Box Office Breakdown: 11 Biggest Stats, Records & Failures	The November 2023 box office featured some underwhelming results, yet some movies exceeded expectations and some hit very important milestones.	Tristan	Napoleon	Box	Michael	Napoleon, Wish	Box	Napoleon, Wish	Box
Trolls Band Together Filmmakers Weren't Afraid To Get Experimental With Their Musical Sequel [Exclusive Interview]	/Film spoke with the filmmakers behind DreamWorks Animation&amp;#39;s Trolls Band Together about dance choreography, tackling different animation styles, and more.	Tristan	Trolls	Prod	Michael	Trolls	Prod	Trolls	Prod
7 scientific breakthroughs that resulted from Napoleon's invasion of Egypt	Over 150 scientists went with Napoleon Bonaparte when he invaded Egypt. They mapped pyramids, dissected mummies, and did more scientific work.	Tristan	Napoleon	NR	Juan	NR		Napoleon	NR
Godzilla Minus One's Director Wants to Do Star Wars, and Oh My Godzilla, Someone Let Him	Photo: Elyse Jankowski (Getty Images) Godzilla Minus One stomps into U.S. theaters today, so director Takashi Yamazaki probably already has a lot on his plate right now. But goddammit, the man wants to do a Star Wars movie, and now I can think of nothing mor…	Tristan	Godzilla	NR	Juan	Godzilla	NR	Godzilla	NR
Godzilla Minus One Gives A Terrifying Upgrade To The Atomic Breath	Godzilla&amp;#39;s famous atomic breath gets an update in the new film Godzilla Minus One. Read all about it right here!	Tristan	Godzilla	Plot	Juan	Godzilla	Plot	Godzilla	Plot
Godzilla Minus One Does Something Very Differently From Other Kaiju Movies	Takashi Yamazaki&amp;#39;s Godzilla Minus One succeeds where the American MonsterVerse Godzilla movies fail: It has compelling human characters we actually care about.	Tristan	Godzilla	Plot	Juan	Godzilla	Plot	Godzilla	Plot
Lily Gladstone Warns of ‘Killers of the Flower Moon’ Triggers: Native Audiences Will Feel ‘Generational Grief’ Onscreen	Never forget this story is recent history with a lasting impact on breathing, feeling people today, Gladstone wrote on social media.	Tristan	KOTFM	Plot	Juan	KOTFM	Plot	KOTFM	Plot
Godzilla Minus One Is Chock-Full Of Easter Eggs Referencing The Original Classic	Godzilla Minus One manages to be a fresh take on the kaiju monster movie and include several intriguing ties to the original film in the franchise.	Tristan	Godzilla	Plot	Juan	Godzilla	Plot	Godzilla	Plot
