source	title	description	url	publishedAt	content	coder 1	movie 1	topic 1	coder 2	movie 2	topic 2	Flag for checks		resolution movie	resolution topic	final movie	final topic
The A.V. Club	Timothée Chalamet celebrates the end of the SAG-AFTRA strike in SNL monologue	Timothée Chalamet returned to Saturday Night Live last night for the show’s first episode since the end of the SAG-AFTRA strike, meaning hosts no longer have to dance around who they are and why they’re there so they don’t look like scabs, and Chalamet celebr…	https://www.avclub.com/timothee-chalamet-snl-monologue-sag-aftra-strike-1851015428	2023-11-12T17:39:00Z	Timothée Chalamet returned to Saturday Night Livelast night for the shows first episode since the end of the SAG-AFTRA strike, meaning hosts no longer have to dance around who they are and why theyre… [+2534 chars]	Juan	NR		Michael	NM				NM		NM	
Screen Rant	10 Longest Martin Scorsese Movies (Including Killers Of The Flower Moon)	Along with his talent, Martin Scorsese is known for his epic narratives that run past the standard 90 minutes. But which of his films are the longest?	https://screenrant.com/martin-scorsese-movies-longest-runtimes/	2023-11-11T22:30:15Z	Summary <ul><li> Martin Scorsese's ability to make longer films comes from years of success and a strong reputation, allowing him the creative freedom to explore bigger narratives. </li><li> Scorses… [+8731 chars]	Juan	KOTFM	NR	Michael	KOTFM	Plot	Length of movie is related to script length		KOTFM	Plot	KOTFM	Plot
Cartoon Brew	The Crew Of ‘Trolls Band Together’ On How To Set Up A Collaborative And Creative Production	'Trolls Band Together' is a jam-packed aural and visual experience that incorporated the input of artists throughout the studio.	https://www.cartoonbrew.com/feature-film/dreamworks-trolls-band-together-inbtwn-animation-235177.html	2023-11-29T23:06:47Z	Dreamworks Animation third feature-length entry in the Trolls franchise, Trolls Band Together, is tearing it up at the box office with a mix of high-energy pop music, candy-coated visuals, and boiste… [+2789 chars]	Juan	Trolls	Prod	Michael	Trolls	Prod					Trolls	Prod
Biztoc.com	‘Trolls Band Together’ Review: Justin Timberlake Sends Up His Boy-Band Past In A Cute Psychedelic Pop Satire	Wanna feel old? The Trolls franchise is seven this year and brings with it a whole culture of nostalgia for the late ’90s and early ’00s that to anyone under 40 will seem like a million years ago. The rest of us might remember it as yesterday; a moment in tim…	https://biztoc.com/x/61ce202aede9e35a	2023-11-17T19:04:53Z	Wanna feel old? The Trolls franchise is seven this year and brings with it a whole culture of nostalgia for the late 90s and early 00s that to anyone under 40 will seem like a million years ago. The … [+302 chars]	Juan	Trolls	Plot	Michael	Trolls	Plot					Trolls	Plot
HuffPost	Leonardo DiCaprio Reveals He Wants To Accomplish 'One More' Thing Before Turning 50	The “Killers of the Flower Moon” star spoke about his goal during an interview with “Good Morning America.”	https://www.huffpost.com/entry/leonardo-dicaprio-one-more-thing-before-turning-50_n_655d2d66e4b0c91d8278f3e2	2023-11-22T01:26:05Z	Leonardo DiCaprio has already accomplished quite a lot since his Hollywood career began in the late 1980s, but the actor is opening up about one more thing he wants to do before he turns 50 next year… [+3604 chars]	Juan	NR		Michael	KOTFM	NR			KOTFM	NR	KOTFM	NR
Screen Rant	Five Nights at Freddy's Got The Same Divisive Response As Another 17-Year-Old Game Adaptation	Five Nights at Freddy's has received mixed reviews, and this response is similar to what another 17-year-old horror video game adaptation faced.	https://screenrant.com/five-nights-freddys-divisive-response-silent-hill/	2023-11-13T18:50:13Z	Summary <ul><li>Five Nights at Freddy's has received mixed reviews from audiences and critics, similar to another video game adaptation from 2006. </li><li> The film appeals to passionate fans of th… [+5309 chars]	Juan	FNAF	Plot	Michael	FNAF	Plot					FNAF	Plot
Screen Rant	Five Nights At Freddy's Springtrap Actor Details Pressures Of Playing Iconic Villain	Matthew Lillard, the actor who played Stringtrap in Five Nights At Freddy's, details the pressure of playing the iconic and beloved villain.	https://screenrant.com/five-nights-at-freddys-springtrap-villain-matthew-lillard/	2023-11-11T18:00:16Z	Summary <ul><li> Matthew Lillard feels immense pressure playing the iconic villain in Five Nights at Freddy's, wanting to deliver a great performance and honor the fans' expectations. </li><li> Lill… [+4495 chars]	Juan	FNAF	Promo	Michael	FNAF	Promo					FNAF	Promo
Screen Rant	Five Nights At Freddy's Rotten Tomatoes Scores Break A Divisive 25-Year Video Game Movie Record	The Five Nights at Freddy's movie has been pretty controversial, causing the film to break a major video game adaptation Rotten Tomatoes record.	https://screenrant.com/five-nights-at-freddys-rotten-tomatoes-divisive-video-game-movie/	2023-11-17T15:20:15Z	Summary <ul><li> The Five Nights at Freddy's movie breaks a 25-year video game movie record with its divisive Rotten Tomatoes scores of 30% from critics and 87% from the audience. </li><li> Despite … [+3266 chars]	Juan	FNAF	Plot	Michael	FNAF	Plot					FNAF	Plot
Screen Rant	Mike's Return In Five Nights At Freddy's 2 Can't Happen If Sequel Follows The Games	2023's Five Nights at Freddy's movie follows the game's plot, with Mike Schmidt as the protagonist. Yet, the next installment may not have him return.	https://screenrant.com/five-nights-at-freddys-2-mike-return-not-possible/	2023-12-06T13:30:18Z	Summary <ul><li> The Five Nights at Freddy's movie centers around Mike Schmidt but he may not appear in the sequel if it follows the video game storyline. </li><li> The second video game is a preque… [+4066 chars]	Juan	FNAF	Plot	Michael	FNAF	Plot					FNAF	Plot
Teen Vogue	Hunter Schafer Calls Hunger Games Role “A Challenge” Compared to Her Euphoria Role	Hunter Schafer plays Tigris in The Hunger Games: The Ballad of Songbirds & Snakes, a character she says was a “challenge” and departure from her Euphoria role.	https://www.teenvogue.com/story/hunter-schafer-compares-hunger-games-role-euphoria-role	2023-11-16T17:28:16Z	If you've ever seen a single episode of HBO's Euphoria, you know the actors do not channel rainbows and butterflies. But according to Hunter Schafer, who plays Jules on the dark, gritty, and often ha… [+893 chars]	Juan	HG	Promo	Michael	HG	Promo					HG	Promo
Dark Horizons	New “Hunger Games” Has $99M Global Debut	“The Hunger Games: The Ballad of Songbirds & Snakes,” Lionsgate’s prequel to their “The Hunger Games” franchise, opened to approximately $44 million at the domestic box office. That’s less than what tracking figures going into the weekend had suggested with t…	https://www.darkhorizons.com/new-hunger-games-has-99m-global-debut/	2023-11-19T20:02:17Z	“The Hunger Games: The Ballad of Songbirds &amp; Snakes,” Lionsgate’s prequel to their “The Hunger Games” franchise, opened to approximately $44 million at the domestic box office. That’s less than … [+1259 chars]	Juan	HG	Box	Michael	HG	Box					HG	Box
Cracked.com	Timothée Chalamet Reminds Us What ‘SNL’ Is Really About: Shameless Project Promotion	Thank goodness we have a way to discover that ‘Wonka’ is coming to theaters on December 15th	https://www.cracked.com/article_40182_timothee-chalamet-reminds-us-what-snl-is-really-about-shameless-project-promotion.html	2023-11-12T14:46:00Z	When Fran Drescher triumphed over the evil AMPTP this week and at long last delivered labor peace to Hollywood, one thing was clear: The Saturday Night Live monologue would once again become a tool t… [+2975 chars]	Juan	NR		Michael	NM				NR		NR	
/FILM	There's One Thing The Marvels Does Better Than Avengers: Endgame	Avengers: Endgame is way more financially successful than The Marvels, but at least the new film meaningfully addresses the underlying concerns of its villain.	https://www.slashfilm.com/1445835/one-thing-the-marvels-does-better-than-avengers-endgame/	2023-11-14T13:00:14Z	This post contains spoilers for "The Marvels." In "The Marvels," Captain Marvel, Ms. Marvel, and Monica Rambeau (the latter of whom, we will, in accordance with Kamala Khan, henceforth call "Profess… [+1279 chars]	Nolin	Marvels	Box	Michael	Marvels	Plot			Marvels	Plot	Marvels	Plot
New York Magazine	Trump Revives His De Niro Feud — and It’s a Flop	Trump responded Robert De Niro’s Gotham Awards speech, calling the actor a ‘total loser.’ We deserve a better Trump celebrity feud than his uninspired beef with the ‘Killers of the Flower’ moon star.	http://nymag.com/intelligencer/2023/12/trump-de-niro-feud.html	2023-12-04T21:37:37Z	Lately Donald Trump has been so focused on attacking GOP primary rivals like Ron DeSanctimonious and smearing low-level court employees that he hasnt had time for a good celebrity feud. Today on Trut… [+2844 chars]	Nolin	KOTFM	NR	Michael	KOTFM	NR					KOTFM	NR
CBC News	Avril Lavigne, Rick Mercer, Tantoo Cardinal among those inducted into Canada's Walk of Fame	Pop-punk icon Avril Lavigne, political satirist Rick Mercer and hockey superstar Connor McDavid were among those inducted into Canada's Walk of Fame tonight at a special anniversary gala in Toronto.	https://www.cbc.ca/news/entertainment/canada-walk-of-fame-avril-lavigne-rick-mercer-25th-anniversary-1.7047565	2023-12-03T00:02:21Z	Pop-punk icon Avril Lavigne, political satirist Rick Mercer and hockey superstar Connor McDavid were among those inducted into Canada's Walk of Fame tonight at a special anniversary gala in Toronto. … [+827 chars]	Nolin	NR		Michael	NR						NR	
The A.V. Club	Every Ridley Scott movie ranked, including Napoleon	It’s been nearly five decades since Ridley Scott’s first feature film, The Duellists, hit theaters, and now, even well into his 80s, the legendary filmmaker shows no signs of slowing. Napoleon, his latest feature, is as grand and intense as anything else in h…	https://www.avclub.com/every-ridley-scott-movie-ranked-including-napoleon-1851029272	2023-11-22T13:00:00Z	Its been nearly five decades since Ridley Scotts first feature film, The Duellists, hit theaters, and now, even well into his 80s, the legendary filmmaker shows no signs of slowing. Napoleon, his lat… [+18318 chars]	Nolin	Napoleon	Plot	Michael	Napoleon	Plot					Napoleon	Plot
/FILM	The Marvels Ending Explained: Let The Sunshine In	The Marvels connects Captain Marvel to the series Ms. Marvel and WandaVision, but here&amp;#39;s a complete guide to everything you need to know about the ending.	https://www.slashfilm.com/1442358/the-marvels-ending-explained/	2023-11-09T22:00:00Z	Dar-Benn makes a plea to the leader of the now-nomadic Skrulls, Emperor Dro'ge (Gary Lewis), on the Skrulls' temporary home of Tarnax: let her relocate the Skrulls and then use the bangle to open a j… [+1530 chars]	Nolin	Marvels	Plot	Michael	Marvels	Plot					Marvels	Plot
/FILM	The Marvels' Young Avengers Tease Originally Featured More Characters [Exclusive]	The Marvels star Iman Vellani has confirmed that she shot a different version of the film&amp;#39;s Young Avengers tease than the one that made the theatrical cut.	https://www.slashfilm.com/1446963/the-marvels-young-avengers-tease-originally-featured-more-characters/	2023-11-15T13:45:30Z	We may end up getting to see the banter between Kate Bishop and Kamala Khan in the film's home media release or a Disney+ special. Considering these two are my absolute favorites of the Young Avenger… [+1201 chars]	Nolin	Marvels	Promo	Michael	Marvels	Plot			Marvels	Promo	Marvels	Promo
/FILM	Bob Iger's 'Supervision' Comment About The Marvels Crossed A Line	On today&amp;#39;s episode of the /Film Daily podcast, Ben and BJ talk about Bob Iger&amp;#39;s absurd comment about The Marvels and whether the Disney CEO is losing his touch.	https://www.slashfilm.com/1460560/bob-iger-supervision-comment-the-marvels-crossed-line/	2023-12-01T21:28:05Z	For years, Bob Iger has been seen as one of the most level-headed and respected studio chiefs in Hollywood. The two-time Walt Disney Company CEO has been widely praised for his shrewd deal-making (th… [+1549 chars]	Nolin	Marvels	NR	Michael	Marvels	NR					Marvels	NR
JoBlo.com	Box Office Update: Hunger Games Prequel seeing under $50 million debut	The long in the tooth title The Hunger Games: The Ballad of Songbirds & Snakes is looking at an opening just shy of the half century mark. The post Box Office Update: Hunger Games Prequel seeing under $50 million debut appeared first on JoBlo.	https://www.joblo.com/box-office-update-hunger-games-prequel-seeing-under-50-million-debut/	2023-11-18T16:04:19Z	The long in the tooth title The Hunger Games: The Ballad of Songbirds &amp; Snakes is looking at an opening just shy of the half century mark. This weekend saw the not quite highly anticipated retur… [+4203 chars]	Nolin	HG	Box	Michael	HG	Box					HG	Box
IGN	The Hunger Games Prequel Withstands Wish and Napoleon to Win 2023's Thanksgiving Weekend Box Office	The Hunger Games: The Ballad of Songbirds and Snakes held off both Disney's Wish and Napoleon to win its second domestic weekend box office over the Thanksgiving holiday.	https://www.ign.com/articles/the-hunger-games-prequel-withstands-wish-and-napoleon-to-win-2023s-thanksgiving-weekend-box-office	2023-11-26T22:08:36Z	The Hunger Games: The Ballad of Songbirds and Snakes held off both Disney's Wish and Napoleon to win its second domestic weekend box office over the Thanksgiving holiday. As reported by Comscore, Th… [+2942 chars]	Nolin	HG, Napoleon, Wish	Box	Michael	HG, Napoleon, Wish	Box					HG, Napoleon, Wish	Box
ComingSoon.net	Beyonce Renaissance Popcorn Bucket: Where to Buy the Tub & Cup	Fans and collectors are looking to buy the Beyonce Renaissance Popcorn Bucket. But how much is it and where can you buy it from? Here’s all the information you need about getting your own Beyonce tub and cup. Where to buy the Beyonce Renaissance popcorn bucke…	https://www.comingsoon.net/guides/news/1411288-beyonce-renaissance-popcorn-bucket-cup-where-to-buy-how-much-cost	2023-11-22T14:16:56Z	Fans and collectors are looking to buy the Beyonce Renaissance Popcorn Bucket. But how much is it and where can you buy it from? Heres all the information you need about getting your own Beyonce tub … [+1545 chars]	Nolin	Renaissance	Promo	Michael	Renaissance	Promo					Renaissance	Promo
BGR	The Marvels flopping is more proof that the MCU is on life support	Before The Marvels premiered on November 10th, I figured the bleak projections would end up being an overreaction. After all, Pixar’s Elemental looked like a … The post The Marvels flopping is more proof that the MCU is on life support appeared first on BGR.	https://bgr.com/entertainment/the-marvels-flopping-is-more-proof-that-the-mcu-is-on-life-support/	2023-11-21T00:06:00Z	Before The Marvels premiered on November 10th, I figured the bleak projections would end up being an overreaction. After all, Pixar’s Elemental looked like a flop on its opening weekend but went on t… [+3581 chars]	Nolin	Marvels	Box	Michael	Marvels	Box					Marvels	Box
Space.com	Save 20% on Lego's Hoopty spaceship from The Marvels this Black Friday	Grab yourself an $18 saving on this fun Lego ship from The Marvels this Black Friday.	https://www.space.com/lego-the-marvels-hoopty-spaceship-black-friday-2023	2023-11-24T21:45:39Z	Space is part of Future US Inc, an international media group and leading digital publisher. Visit our corporate site. © Future US, Inc. Full 7th Floor, 130 West 42nd Street, New York, NY 10036.	Nolin	Marvels	Promo	Michael	Marvels	Promo					Marvels	Promo
GameSpot	Iman Vellani On The Marvels Box Office Struggles: "That's For Bob Iger"	Iman Vellani, back as Kamala Khan/Ms. Marvel in The Marvels, remains unfazed by the film's box office performance since its November 10 release--it opened to $47 million domestically and just under $100 million worldwide, marking the weakest start for a Marve…	https://www.gamespot.com/articles/iman-vellani-on-the-marvels-box-office-struggles-thats-for-bob-iger/1100-6519328/	2023-11-20T17:46:00Z	Iman Vellani, back as Kamala Khan/Ms. Marvel in The Marvels, remains unfazed by the film's box office performance since its November 10 release--it opened to $47 million domestically and just under $… [+1614 chars]	Nolin	Marvels	Box	Michael	Marvels	Box					Marvels	Box
The A.V. Club	It’s not Iman Vellani’s problem that The Marvels is a bomb	Marvel’s The Marvels is having a pretty lousy time at the box office, having already gotten the worst opening in MCU history and then a huge drop-off in its second week, but star Iman Vellani—who plays Ms. Marvel, a.k.a. Kamala Khan—isn’t phased by it. In fac…	https://www.avclub.com/not-iman-vellani-s-problem-that-the-marvels-is-a-bomb-1851037050	2023-11-20T22:16:00Z	Marvels The Marvelsis having a pretty lousy time at the box office, having already gotten the worst opening in MCU history and then a huge drop-off in its second week, but star Iman Vellaniwho plays … [+1612 chars]	Nolin	Marvels	Box	Michael	Marvels	Box					Marvels	Box
HuffPost	Furious De Niro Realizes Anti-Trump Lines Cut From Teleprompter Mid-Speech	"How dare they do that, actually?” the "Killers of the Flower Moon" star said on stage at the Gotham Awards before reading the remarks from his phone anyway.	https://www.huffpost.com/entry/robert-de-niro-gotham-awards-teleprompter_n_6565d48ee4b0f35896f75bca	2023-11-28T12:30:58Z	Robert De Niro expressed his anger on stage at the 33rd Gotham Awards on Monday after anti-Donald Trump comments hed prepared to say during a speech about his latest film, the Martin Scorsese-directe… [+4300 chars]	Nolin	KOTFM	NR	Michael	KOTFM	NR					KOTFM	NR
Bleeding Cool News	Five Nights At Freddy's Star on the Film's Success and Sequel Hopes	Even though the recent horror film Five Nights At Freddy's was released simultaneously in theaters and on Peacock, the live-action adaptation of the popular video game became quite a hit with audiences. In fact, as of now, the film has already proven to be a …	https://bleedingcool.com/movies/five-nights-at-freddys-star-on-the-films-success-and-sequel-hopes/	2023-11-15T01:17:07Z	Posted in: Horror, Movies, Universal | Tagged: blumhouse, film, five nights at freddy's, horror Matthew Lillard is discussing the reception of Five Nights At Freddy's and his hopes that the sequel w… [+2508 chars]	Nolin	FNAF	Box	Michael	FNAF	Box	*				FNAF	Box
Bleeding Cool News	Five Nights At Freddy's Hits Blu-ray December 12th, Digital Next Week	Five Nights At Freddy's has been a smash success at the fall box office, and Universal and Blumhouse are rushing to make sure fans can enjoy the film at home for the holidays. The horror hit is set to release on digital rental services next Tuesday, November …	https://bleedingcool.com/movies/five-nights-at-freddys-digital-next-week-disc-december-12/	2023-11-21T19:17:08Z	Posted in: 4K/Blu-Ray, Movies, Universal | Tagged: blumhouse, five nights at freddy's, universal Five Nights At Freddy's fans will have the hit film to watch at home soon, as it hits digital next we… [+2998 chars]	Nolin	FNAF	Box	Michael	FNAF	Streaming			FNAF	Streaming	FNAF	Streaming
Daily Beast	‘Godzilla Minus One’ Brings All the Mayhem and Destruction You Crave	Toho Studios When it comes to bringing Godzilla to thrilling, terrifying life, America’s track record has been spotty at best, marked by a few minor highs (2014’s Godzilla, 2021’s Godzilla vs. Kong) and lots of lows (virtually everything else, including Appl…	https://www.thedailybeast.com/obsessed/godzilla-minus-one-review-all-the-mayhem-and-destruction-you-crave	2023-11-30T09:47:37Z	When it comes to bringing Godzilla to thrilling, terrifying life, Americas track record has been spotty at best, marked by a few minor highs (2014s Godzilla,2021s Godzilla vs. Kong) and lots of lows … [+6274 chars]	Nolin	Godzilla	Plot	Michael	Godzilla	Plot					Godzilla	Plot
Los Angeles Times	Robert De Niro says lines on Trump, Native Americans were cut from Gotham Awards speech	Robert De Niro alleged on the Gotham Awards stage that political lines about Trump and Native Americans in Hollywood had been edited out of his speech.	https://www.latimes.com/entertainment-arts/movies/story/2023-11-28/robert-de-niro-gotham-awards-speech-edited-trump	2023-11-28T20:46:37Z	Robert De Niro alleged on the 2023 Gotham Awards stage Monday evening that lines critical of former President Trump and Hollywoods mistreatment of Native Americans had been edited out of the speech h… [+3643 chars]	Nolin	NM		Michael	NM						NM	
Bleeding Cool News	Godzilla Minus One Super7 Ultimates Figure Up For Preorder	Godzilla Minus One is being hailed as the best Godzilla movie in years and possibly the best ever. Thankfully, toy companies are on the ball, and we didn't have to wait long for figures of this version to go up for order. Super7 has the preorder up for their …	https://bleedingcool.com/collectibles/super7-godzilla-minus-one-ultimates-figure-preorder/	2023-12-02T18:22:08Z	Posted in: Collectibles, Super7 | Tagged: godzilla, Godzilla Minus One, Super7 Super7 has their new Ultimates Godzilla Minus One figure up for preorder for shipping in 2024. It is available until Ja… [+2215 chars]	Nolin	Godzilla	Promo	Michael	Godzilla	Promo					Godzilla	Promo
Vulture	The National Board of Review Loves Scorsese, The Holdovers	The National Board of Review’s 2023 honorees include Martin Scorsese’s ‘Killers of the Flower Moon’ and Paul Giamatti-starring ‘The Holdovers.’	http://www.vulture.com/2023/12/national-board-of-review-honorees-2023.html	2023-12-06T21:58:50Z	We are in the early throes of awards season, with new nominations and honors being announced seemingly every day bolstering some Oscar chances and crushing the dreams of others. If you have a horse i… [+2245 chars]	Nolin	KOTFM	Plot	Michael	KOTFM	Awards			KOTFM	Awards	KOTFM	Awards
ABC News	‘Hunger Games’ prequel tops box office, 'Trolls Band Together' opens in 2nd place	“The Hunger Games: The Ballad of Songbirds & Snakes” tops the North American box office in its first weekend in theaters	https://abcnews.go.com/Entertainment/wireStory/hollywoods-feast-famine-thanksgiving-hunger-games-prequel-tops-105015794	2023-11-19T17:53:49Z	The Hunger Games: The Ballad of Songbirds &amp; Snakes topped the North American box office in its first weekend in theaters with $44 million in ticket sales, according to studio estimates Sunday. I… [+3757 chars]	Nolin	HG, Trolls	Box	Michael	HG, Trolls	Box					HG, Trolls	Box
The A.V. Club	Napoleon review: Ridley Scott delivers a dynamite biopic	Outside of military colleges, where his strategic acumen is still lauded, many present-day folks might only have a loose sense of Napoleon Bonaparte, with a bicorne hat and hand tucked in his jacket, as a man of short stature and shorter temper. Director Ridl…	https://www.avclub.com/napoleon-movie-review-ridley-scott-joaquin-phoenix-1851025868	2023-11-21T14:00:00Z	Outside of military colleges, where his strategic acumen is still lauded, many present-day folks might only have a loose sense of Napoleon Bonaparte, with a bicorne hat and hand tucked in his jacket,… [+6899 chars]	Nolin	Napoleon	Plot	Michael	Napoleon	Plot	*				Napoleon	Plot
Screen Rant	Where To Watch Godzilla Minus One: Showtimes & Streaming Status	Godzilla Minus One is the latest movie from Toho, and there are different options to watch the movie in theaters or at home on streaming.	https://screenrant.com/where-to-watch-godzilla-minus-one-showtimes-streaming/	2023-11-30T16:50:13Z	Summary <ul><li> Godzilla Minus One is a new Toho monster movie that brings the King of the Monsters back as an antagonistic presence terrorizing Japan after World War II. </li><li> The film holds n… [+3731 chars]	Nolin	Godzilla	Streaming	Michael	Godzilla	Streaming					Godzilla	Streaming
IndieWire	‘May December’ Is Down to #9 on Netflix After Three Days, While 2018 Gerard Butler Thriller ‘Hunter Killer’ Is #4	"Oppenheimer" is still number one on the PVOD charts.	https://www.indiewire.com/news/box-office/streaming-charts-may-december-netflix-1234931835/	2023-12-04T23:30:00Z	Remember “Hunter Killer”? To jog your memory, it was a 2018 Lionsgate release starring Gerard Butler and Gary Oldman in a story about the U.S. Navy rescuing a kidnapped Russian president. It eked ou… [+6558 chars]	Nolin	KOTFM	Box	Michael	NM		*		NM		NM	
Mental Floss	11 Facts About Joséphine de Beauharnais	Ahead of the release of Ridley Scott’s biopic, ‘Napoleon,’ here are 11 facts about the woman who once stood in the emperor’s shadow.	https://www.mentalfloss.com/posts/josephine-de-beauharnais-napoleon-facts	2023-11-16T23:00:01Z	Joséphine de Beauharnais and Napoleon Bonapartes relationship is the stuff of legends. But before they met, de Beauharnais experienced significant hardship. Even after she married Napoleonher second … [+7309 chars]	Nolin	Napoleon	NR	Michael	Napoleon	NR	*				Napoleon	NR
The A.V. Club	The Marvels is headed for one of the MCU's all-time worst box office openings	Whatever your feelings about the current creative state of the Marvel Cinematic Universe, it’s hard to deny that the franchise’s financial issues are becoming more obvious by the week. That’s come into especially tight focus this week, with the release of Nia…	https://www.avclub.com/the-marvels-is-headed-for-one-of-the-mcus-all-time-wors-1851014431	2023-11-11T20:21:00Z	Whatever your feelings about the current creative state of the Marvel Cinematic Universe, its hard to deny that the franchises financial issues are becoming more obvious by the week. Thats come into … [+1884 chars]	Nolin	Marvels	Box	Michael	Marvels	Box					Marvels	Box
